CodeShark,2015-10-21T21:57:49Z,ACK\n,https://github.com/bitcoin/bitcoin/pull/6865#issuecomment-150036788,150036788,
sipa,2015-10-21T22:08:28Z,Seems we have tests that test for the incorrect behaviour?\n,https://github.com/bitcoin/bitcoin/pull/6865#issuecomment-150038762,150038762,
dcousens,2015-10-21T22:18:59Z,ACK\n,https://github.com/bitcoin/bitcoin/pull/6865#issuecomment-150040773,150040773,
gmaxwell,2015-10-21T23:08:39Z,ACK / Tested ACK.  Also ... tests are not very meaningful if an effort isn't put in to verify that they're actually testing something. :(\n,https://github.com/bitcoin/bitcoin/pull/6865#issuecomment-150049775,150049775,
jonasschnelli,2015-10-22T08:16:04Z,Tests require an update.\nhttps://github.com/bitcoin/bitcoin/blob/master/qa/rpc-tests/blockchain.py#L46\n`bytes_serialized` is no longer 130'000 bytes \nhttps://travis-ci.org/bitcoin/bitcoin/jobs/86716075#L4329 \n,https://github.com/bitcoin/bitcoin/pull/6865#issuecomment-150141006,150141006,
gmaxwell,2015-10-22T09:04:30Z,"It was never 130000 bytes, the test hardcoded an obviously broken value-- not finding the error in the very thing it was testing; thus my complaint above. :(\n",https://github.com/bitcoin/bitcoin/pull/6865#issuecomment-150155426,150155426,
laanwj,2015-10-22T15:40:50Z,ACK after test fixed\n,https://github.com/bitcoin/bitcoin/pull/6865#issuecomment-150266115,150266115,
jgarzik,2015-10-27T19:28:16Z,ditto @laanwj - ACK after test fixed\n,https://github.com/bitcoin/bitcoin/pull/6865#issuecomment-151617778,151617778,
sipa,2015-10-28T00:07:42Z,"Test should be fixed, and fix was tested.\n",https://github.com/bitcoin/bitcoin/pull/6865#issuecomment-151680272,151680272,
