laanwj,2016-02-29T08:04:51Z,ACK fa100ec\n,https://github.com/bitcoin/bitcoin/pull/7617#issuecomment-190085907,190085907,
jonasschnelli,2016-02-29T09:02:44Z,ACK fa100ecb9795fe4a6c4a0f928fc8e9858e979303\n,https://github.com/bitcoin/bitcoin/pull/7617#issuecomment-190110872,190110872,
btcdrak,2016-02-29T09:10:43Z,ACK\n,https://github.com/bitcoin/bitcoin/pull/7617#issuecomment-190113385,190113385,
laanwj,2016-02-29T10:21:29Z,"Tangential: Would be awesome to have a lint-er that checked these kinds of things: LogPrint[f]/strprintf number of arguments versus number of %, line breaks (although there are cases where you explicitly don't want them, but I they could be marked insome way).\n",https://github.com/bitcoin/bitcoin/pull/7617#issuecomment-190141896,190141896,
laanwj,2016-02-29T08:03:57Z,"Oops, yes, this was a backport\n",https://github.com/bitcoin/bitcoin/pull/7617#discussion_r54377927,54377927,doc/release-notes/release-notes-0.12.0.md
laanwj,2016-03-01T13:22:15Z,"Are you sure this is correct? I think this was supposed to be un-terminated, because other message-related commands continue the logging.\n",https://github.com/bitcoin/bitcoin/pull/7617#discussion_r54565039,54565039,src/net.cpp
MarcoFalke,2016-03-01T13:40:37Z,I remember I saw at least one instance which was wrong but I can't recall which one as I have deleted the `debug.log` in the meantime. I have reverted for now and will look into this later.\n,https://github.com/bitcoin/bitcoin/pull/7617#discussion_r54567075,54567075,src/net.cpp
