laanwj,2014-09-17T06:50:27Z,"Can you rebase this on top of @sipa's #4899? I plan to merge that next, and I'm sure multiple sets of changes to script will conflict.\n",https://github.com/bitcoin/bitcoin/pull/4934#issuecomment-55855471,55855471,
theuni,2014-09-17T06:51:26Z,And now I see #4899....\n,https://github.com/bitcoin/bitcoin/pull/4934#issuecomment-55855544,55855544,
theuni,2014-09-17T06:53:13Z,"I've tried to keep up with the script movement PRs, but looks like I missed some. I'll have a look at this again tomorrow, very possible that this was a completely duplicated effort.\n",https://github.com/bitcoin/bitcoin/pull/4934#issuecomment-55855658,55855658,
laanwj,2014-09-17T06:56:23Z,Yes it looks like some coordination is needed to make sure we're all on the same page. For ages hardly anyone touched the script headers at all but recently there has been a flurry of activity.\n,https://github.com/bitcoin/bitcoin/pull/4934#issuecomment-55855889,55855889,
BitcoinPullTester,2014-09-17T06:58:01Z,"Automatic sanity-testing: PASSED, see http://jenkins.bluematt.me/pull-tester/p4934_bed34efe865fde80e7b0db1b4419c9d55fe66341/ for binaries and test log.\nThis test script verifies pulls every time they are updated. It, however, dies sometimes and fails to test properly.  If you are waiting on a test, please check timestamps to verify that the test.log is moving at http://jenkins.bluematt.me/pull-te",https://github.com/bitcoin/bitcoin/pull/4934#issuecomment-55856004,55856004,
theuni,2014-09-17T07:04:53Z,"Yea, this is an exact duplicate of #4899. @sipa nice work :)\n",https://github.com/bitcoin/bitcoin/pull/4934#issuecomment-55856550,55856550,
