katesalazar,2021-11-23 15:54:11,"""./contrib/install_db4.sh: line 71: patch: command not found"" is not obscure enough to need an improvement. NAK.\n",https://github.com/bitcoin/bitcoin/pull/23579#issuecomment-976756754,976756754,
MarcoFalke,2021-11-23 16:51:26,"Wouldn't it be best to remove this script? We already have `depends`, which can build bdb4.",https://github.com/bitcoin/bitcoin/pull/23579#issuecomment-976842849,976842849,
ngara,2021-11-23 19:35:30,@katesalazar not looking for an adjustment to the message; only to check dependencies before starting write operations -- at least for new users like myself who may not have everything installed yet.,https://github.com/bitcoin/bitcoin/pull/23579#issuecomment-977069633,977069633,
ngara,2021-11-23 19:42:30,"For reference, I was following this doc: https://github.com/bitcoin/bitcoin/blob/master/doc/build-unix.md#berkeley-db",https://github.com/bitcoin/bitcoin/pull/23579#issuecomment-977079034,977079034,
laanwj,2021-11-24 10:48:15,"Concept ACK, thanks for your contribution.\n\n> Wouldn't it be best to remove this script? We already have depends, which can build bdb4.\n\nThe depends framework doesn't work on all the platforms that this script works, IIRC. Think of the BSDs.\nAlso it's a simple command to run, nothing to figure out. If we want to encourage people to use depends for this we should document a command that b",https://github.com/bitcoin/bitcoin/pull/23579#issuecomment-977756677,977756677,
laanwj,2021-11-25 20:12:53,Code review and tested ACK 7bb8eb0bc352b47ee962283898f9becbb4f36c62,https://github.com/bitcoin/bitcoin/pull/23579#issuecomment-979451110,979451110,
