BitcoinPullTester,2013-11-27T16:08:29Z,"Automatic sanity-testing: PASSED, see http://jenkins.bluematt.me/pull-tester/8e06e2f48ce284775e8620cd39378c6e43bcf156 for binaries and test log.\nThis test script verifies pulls every time they are updated. It, however, dies sometimes and fails to test properly.  If you are waiting on a test, please check timestamps to verify that the test.log is moving at http://jenkins.bluematt.me/pull-tester/cu",https://github.com/bitcoin/bitcoin/pull/3281#issuecomment-29396340,29396340,
laanwj,2013-12-12T11:01:44Z,Closing this for now\n,https://github.com/bitcoin/bitcoin/pull/3281#issuecomment-30406783,30406783,
sipa,2014-01-13T15:59:59Z,I think this can be reopened - the only objection ever was some confusion about a variable name...\n,https://github.com/bitcoin/bitcoin/pull/3281#issuecomment-32182092,32182092,
laanwj,2014-01-13T16:02:47Z,"Yes, I closed it because I had too many other active pulls in the air at that point, not because of any problem with the code. Reopened.\nEdit: also needs rebase it appears\n",https://github.com/bitcoin/bitcoin/pull/3281#issuecomment-32182389,32182389,
laanwj,2014-01-15T13:27:54Z,Closing in favor of #3521\n,https://github.com/bitcoin/bitcoin/pull/3281#issuecomment-32360916,32360916,
sipa,2013-11-22T12:33:15Z,"What does ""gen"" stand for?\n",https://github.com/bitcoin/bitcoin/pull/3281#discussion_r7854574,7854574,src/wallet.h
laanwj,2013-11-22T12:34:00Z,"GENeric data, is a leftover, should be destdata\n",https://github.com/bitcoin/bitcoin/pull/3281#discussion_r7854587,7854587,src/wallet.h
