laanwj,2019-07-30 16:17:08,Concept ACK,https://github.com/bitcoin/bitcoin/pull/16431#issuecomment-516489955,516489955,
laanwj,2019-09-30 11:30:42,"Please squash the commits, and remove any @ username from the commit message (because that causes trouble).",https://github.com/bitcoin/bitcoin/pull/16431#issuecomment-536520967,536520967,
laanwj,2019-10-08 09:52:40,"The author is taking too long to respond to comments. Closing as ""Up for grabs"". Let me know if you want to start work on this again and I'll re-open.",https://github.com/bitcoin/bitcoin/pull/16431#issuecomment-539440257,539440257,
Rjected,2019-10-28 03:12:59,"Do you mind if I submit a PR for this?\nI have a refactored & commented version in my fork: [`317fb96`](https://github.com/Rjected/bitcoin/commit/317fb96de9c6257972f1213b4ef2c3fe87dde99f)",https://github.com/bitcoin/bitcoin/pull/16431#issuecomment-546774832,546774832,
promag,2019-07-23 08:51:21,Could add a comment here explaining the following lines.,https://github.com/bitcoin/bitcoin/pull/16431#discussion_r306201539,306201539,contrib/linearize/linearize-data.py
cryptogopher,2019-07-26 19:01:17,Added comment. Please feel free to modify at the discretion.,https://github.com/bitcoin/bitcoin/pull/16431#discussion_r307872748,307872748,contrib/linearize/linearize-data.py
laanwj,2019-07-30 16:16:57,"would make sense to factor this out to a function, `getFirstBlockFileId(path)` or such",https://github.com/bitcoin/bitcoin/pull/16431#discussion_r308815623,308815623,contrib/linearize/linearize-data.py
