NicolasDorier,2015-12-09T03:49:24Z,"Yes, CheckLockTime assumes that if a parent is not in CCoinView, then the locktime is correct. I don't want this behavior in CNB, what I want is : if it is not in CCoinView, assume it is in the mempool. \n\nBut this will likely be completely deleted because I managed to keep mempool consistent with finality while not having to call CheckLockTime on every tx in the mempool during reorg (which was a",https://github.com/bitcoin/bitcoin/pull/6312#issuecomment-163096294,163096294,
NicolasDorier,2015-12-10T15:57:48Z,Is there any concern about assuming MTP only in LockTime() so we can get rid of the MTP flag ? (and get rid off the enum by the same occasion)\n,https://github.com/bitcoin/bitcoin/pull/6312#issuecomment-163669105,163669105,
morcos,2015-12-10T16:03:50Z,"@NicolasDorier We need MTP and BIP 113 and the enum all for the purposes of nLockTime locks because nLockTime is already consensus and we want to soft fork its semantics to be MTP.\n\nHowever in the case of sequence locks and BIP 68, there is no reason for us to not just redefine BIP 68 to have MTP semantics from the outset, because there is no policy or consensus meaning to sequence locks yet.\n",https://github.com/bitcoin/bitcoin/pull/6312#issuecomment-163670736,163670736,
NicolasDorier,2015-12-10T16:23:34Z,Ok thanks. So we can't change anything in this PR relative to the MTP flags.\n,https://github.com/bitcoin/bitcoin/pull/6312#issuecomment-163676409,163676409,
NicolasDorier,2015-12-14T10:55:55Z,"This change to BIP68 (https://github.com/bitcoin/bips/pull/260) while making a clearer specification  just broke completely this PR. Basically this PR assumed similar blocktime calculation (MTP or not) policy for both nLockTime and sequence lock time. But the change of specification makes MTP mandatory for sequence locktime while nLockTime is still depends on MTP activation.\n\nThis PR, if preferr",https://github.com/bitcoin/bitcoin/pull/6312#issuecomment-164408472,164408472,
btcdrak,2015-12-14T14:27:11Z,"The assumption of MTP only was discussed at the [IRC meeting](http://www.erisian.com.au/meetbot/bitcoin-dev/2015/bitcoin-dev.2015-12-10-19.01.log.html) and that BIP68 and BIP113 need to be softforked together.\n\nI am in favour of #7184. However, the assumption was if this PR is chosen over #7184 then this PR would be updated accordingly to the new specification. It's just #7184 already made the a",https://github.com/bitcoin/bitcoin/pull/6312#issuecomment-164450794,164450794,
morcos,2015-12-14T14:35:58Z,"Yeah sorry about that, I guess it is a bit tough to try to keep BIP spec in line with code.\nBut honestly I think this confusion shows why I like the code organization of #7184 better.  The consensus code for sequence and nLockTime is too intermingled here.\n\nOne of the hesitations with switching to #7184 has been that this PR is already heavily reviewed and tested.  I think this is wrong.  It ha",https://github.com/bitcoin/bitcoin/pull/6312#issuecomment-164452735,164452735,
btcdrak,2015-12-14T14:52:20Z,"@morcos I absolutely agree, we cannot claim this PR is well reviewed because each reviewer, reviewed it in a different state. Regardless, this has been beneficial in refining the specification and implementation.\n",https://github.com/bitcoin/bitcoin/pull/6312#issuecomment-164456790,164456790,
NicolasDorier,2015-12-14T15:09:39Z,"Understood, I have no particular feeling about it, just worried #7184 would delay CSV adoption for months.\n",https://github.com/bitcoin/bitcoin/pull/6312#issuecomment-164461520,164461520,
jtimon,2015-12-20T07:21:34Z,">  I think this is wrong. It had a lot of preliminary review, but then the code changed, and I think its had only minimal testing. \n\nIt is true that the code changed after most of the reviews were done. Fortunately @btcdrak kept the commits separated so that concern has an easy solution: remove the latest changes.\nI have to say that this has also been tested as part of the elements/alpha testch",https://github.com/bitcoin/bitcoin/pull/6312#issuecomment-166076967,166076967,
NicolasDorier,2015-12-20T10:18:28Z,"@jtimon one of my change is actually a bug fix... sadly it was squashed. Regardless of what happen, this should be kept.\n\nThe problem was that the birth time of an unconfirmed coin was set to blockTime which depended on MTP activation. Whereas confirmed coins always used MTP time.\n",https://github.com/bitcoin/bitcoin/pull/6312#issuecomment-166104419,166104419,
maaku,2015-12-20T10:28:00Z,"I have to say it was bad form that #7184 merged everything into one commit as it makes the review significantly harder (and less critically, credit assignment less clear). I think it was also bad form to split off a separate PR for the exact same feature, rather than discuss the alternative implementation pathway in the same thread, but I digress...\n",https://github.com/bitcoin/bitcoin/pull/6312#issuecomment-166106783,166106783,
jtimon,2015-12-20T10:56:33Z,"@NicolasDorier Well, if it was a bugfix then it's not sad that it was squashed, is it?\nI mean more the later changes to make the function a pure function, which is, I assume the less reviewed changes @morcos is concerned with.\n\nIn my opinion no optimization had been needed in the mining code this could have been merged before 0.12 with no backporting problems. If the optimizations hadn't been u",https://github.com/bitcoin/bitcoin/pull/6312#issuecomment-166109869,166109869,
NicolasDorier,2015-12-20T11:03:01Z,"By ""sad being squashed"", I mean that if you want to revert recent changes I made, at least you should keep the bug fix commit. Extracting it would have been simpler without squash. (but well, the bug is not a big deal to fix again)\n",https://github.com/bitcoin/bitcoin/pull/6312#issuecomment-166110134,166110134,
maaku,2015-12-20T11:14:47Z,"Which is why it is better not to squash until the very end before merge.\nOn Dec 20, 2015 7:04 PM, ""Nicolas Dorier"" notifications@github.com wrote:\n\n> By ""sad being squashed"", I mean that if you want to revert recent changes\n> I made, at least you should keep the bug fix commit. Extracting it would\n> have been simpler without squash. (but well, the bug is not a big deal to\n> fix again)\n> \n>",https://github.com/bitcoin/bitcoin/pull/6312#issuecomment-166110519,166110519,
btcdrak,2015-12-20T11:55:09Z,@maaku I think #7184 can be redone with commit history. @morcos \n,https://github.com/bitcoin/bitcoin/pull/6312#issuecomment-166111941,166111941,
morcos,2015-12-20T13:02:16Z,As already posted on #7184\n\nhttps://github.com/maaku/bitcoin/compare/sequencenumbers...morcos:7184onorig6312\n\nFeel free to incorporate that here if that is preferred. \n,https://github.com/bitcoin/bitcoin/pull/6312#issuecomment-166115140,166115140,
rustyrussell,2016-01-07T04:23:15Z,"Tested-by: Rusty Russell rusty@rustcorp.com.au\n\n(I merged both this and #6564 for the test, with only a trivial conflict to resolve).\n",https://github.com/bitcoin/bitcoin/pull/6312#issuecomment-169545913,169545913,
btcdrak,2016-01-14T19:57:25Z,Closing in favour of #7184 \n,https://github.com/bitcoin/bitcoin/pull/6312#issuecomment-171762235,171762235,
luke-jr,2015-06-24T23:59:09Z,Probably should call this something other than sequence?\n,https://github.com/bitcoin/bitcoin/pull/6312#discussion_r33211341,33211341,src/consensus/consensus.h
luke-jr,2015-06-24T23:59:21Z,IsFinalTx was a better name IMO.\n,https://github.com/bitcoin/bitcoin/pull/6312#discussion_r33211350,33211350,src/main.cpp
luke-jr,2015-06-26T01:31:35Z,"The version check is in LockTime already, so redundant here...\n",https://github.com/bitcoin/bitcoin/pull/6312#discussion_r33322311,33322311,src/main.cpp
luke-jr,2015-06-26T01:32:11Z,Perhaps STANDARD_LOCKTIME_VERIFY_FLAGS instead of nLockTimeFlags?\n,https://github.com/bitcoin/bitcoin/pull/6312#discussion_r33322326,33322326,src/main.cpp
luke-jr,2015-06-26T01:32:26Z,"The version check is in LockTime already, so redundant here...\n",https://github.com/bitcoin/bitcoin/pull/6312#discussion_r33322335,33322335,src/miner.cpp
dcousens,2015-08-13T22:10:46Z,`s/sequnce/sequence`\n,https://github.com/bitcoin/bitcoin/pull/6312#discussion_r37031834,37031834,src/main.cpp
maaku,2015-08-18T01:34:37Z,"Took me a while to see what you're suggestion, but I agree. I'll rework it to be a policy.h option.\n",https://github.com/bitcoin/bitcoin/pull/6312#discussion_r37256672,37256672,src/main.cpp
luke-jr,2015-08-19T02:22:51Z,Probably should call this something other than sequence?\n,https://github.com/bitcoin/bitcoin/pull/6312#discussion_r37374565,37374565,src/consensus/consensus.h
luke-jr,2015-08-19T02:23:11Z,IsFinalTx was a better name IMO.\n,https://github.com/bitcoin/bitcoin/pull/6312#discussion_r37374581,37374581,src/main.cpp
maaku,2015-08-19T02:33:02Z,"Luke, did you notice that the semantics changed? That's why the name\nchanged.\nOn Aug 18, 2015 7:23 PM, ""Luke-Jr"" notifications@github.com wrote:\n\n> In src/main.cpp\n> https://github.com/bitcoin/bitcoin/pull/6312#discussion_r37374581:\n> \n> > @@ -638,22 +638,110 @@ unsigned int LimitOrphanTxSize(unsigned int nMaxOrphans) EXCLUSIVE_LOCKS_REQUIRE\n> >      return nEvicted;\n> >  }\n> > \n> > -bo",https://github.com/bitcoin/bitcoin/pull/6312#discussion_r37374960,37374960,src/main.cpp
luke-jr,2015-08-19T03:23:33Z,"You mean because it returns int64_t instead of bool? But unless I missed a spot, the return value is only ever _used_ as a bool in the same sense...\n",https://github.com/bitcoin/bitcoin/pull/6312#discussion_r37376960,37376960,src/main.cpp
maaku,2015-08-19T03:42:44Z,"No it switches to opposite meaning -- zero indicates tx is final, nonzero\nindicates when it will become final.\nOn Aug 18, 2015 8:24 PM, ""Luke-Jr"" notifications@github.com wrote:\n\n> In src/main.cpp\n> https://github.com/bitcoin/bitcoin/pull/6312#discussion_r37376960:\n> \n> > @@ -638,22 +638,110 @@ unsigned int LimitOrphanTxSize(unsigned int nMaxOrphans) EXCLUSIVE_LOCKS_REQUIRE\n> >      return",https://github.com/bitcoin/bitcoin/pull/6312#discussion_r37377633,37377633,src/main.cpp
maaku,2015-08-19T04:02:54Z,"To expand, the change in semantics is required because it is no longer a\nsimple matter to introspect the transaction to see how long it will remain\nnon-final. You will see in some parts of the GUI code for example its\nreturn value is saved and used to calculate how long the transaction will\nremain locked, which is then displayed to the user.\n",https://github.com/bitcoin/bitcoin/pull/6312#discussion_r37378264,37378264,src/main.cpp
dcousens,2015-08-19T04:11:07Z,`RELATIVE_LOCKTIME_THRESHOLD`?\n,https://github.com/bitcoin/bitcoin/pull/6312#discussion_r37378485,37378485,src/consensus/consensus.h
btcdrak,2015-09-23T12:55:58Z,"""I believe this is incorrect, as LockTime() is called for the coinbase transaction by ContextualCheckBlock()"" - @petertodd from [other branch](https://github.com/maaku/bitcoin/commit/d454248ad6eab502762ed0b0aaa37d0f646f1844#commitcomment-13327523)\n",https://github.com/bitcoin/bitcoin/pull/6312#discussion_r40199246,40199246,src/main.cpp
sipa,2015-09-23T14:15:03Z,"Would it be possible to retain the old IsFinalTx function, including its code, but replace its ""return true;"" statements by ""return LockTime(...) == 0"", and use that in consensus code? That would make it trivial to see this is a softfork.\n",https://github.com/bitcoin/bitcoin/pull/6312#discussion_r40207799,40207799,src/main.cpp
maaku,2015-09-23T17:40:24Z,"Yep that would have been better. However I wonder if this is necessary or desirable now that this PR has received many full reviews, including verification that the change is a soft-fork.\n\nIf you or others are having trouble verifying this, I recommend looking at the individual commits. There are two preparatory commits that contain no consensus changes, only rearrangement of the logic for IsFin",https://github.com/bitcoin/bitcoin/pull/6312#discussion_r40233364,40233364,src/main.cpp
maaku,2015-09-23T21:28:25Z,I have broken out another commit in order to make review easier.\n,https://github.com/bitcoin/bitcoin/pull/6312#discussion_r40260094,40260094,src/main.cpp
petertodd,2015-10-08T16:44:06Z,"This is kinda scary... I'd much rather see the UTXO not found, yet it should be there, case fail hard (by an assertion?) than introduce new consensus behavior in the case of bugs.\n",https://github.com/bitcoin/bitcoin/pull/6312#discussion_r41537512,41537512,src/main.cpp
petertodd,2015-10-08T17:11:06Z,Is this case tested anywhere?\n,https://github.com/bitcoin/bitcoin/pull/6312#discussion_r41540525,41540525,src/main.cpp
sipa,2015-10-13T17:45:08Z,"(summarizing earlier discussion about this) The problem is that that would be the case whenever the wallet check finality on an transaction whose inputs are already spent.\n\nIMHO the clean solution is to pass in the heights/times of all inputs to this function, which could have a different implementation for mempool/wallet/blockchain behaviour. Another - but probably more invasive change - would ",https://github.com/bitcoin/bitcoin/pull/6312#discussion_r41899674,41899674,src/main.cpp
sipa,2015-10-13T17:48:58Z,"@maaku Did you test this in conjunction with a wallet? My guess is that it will start hiding all old transactions whose inputs are completely spent, because they are treated as non-final.\n",https://github.com/bitcoin/bitcoin/pull/6312#discussion_r41900142,41900142,src/main.cpp
maaku,2015-10-19T21:10:31Z,Reverted to prior behavior of continuing to the next input if the UTXO doesn't exist in the view.\n,https://github.com/bitcoin/bitcoin/pull/6312#discussion_r42426354,42426354,src/main.cpp
sdaftuar,2015-10-21T19:13:56Z,"We need to hold `cs_main` for this, though I think the callers already do.  So perhaps an `AssertLockHeld(cs_main)` would be appropriate at the top of this function?\n",https://github.com/bitcoin/bitcoin/pull/6312#discussion_r42668695,42668695,src/main.cpp
btcdrak,2015-10-23T23:03:26Z,It is worth noting that this function was IsFinalTx() which does not currently have an `AssertLockHeld(cs_main)` in the main tree. I don't think it does any harm adding an assert though.\n,https://github.com/bitcoin/bitcoin/pull/6312#discussion_r42923384,42923384,src/main.cpp
btcdrak,2015-10-24T06:58:21Z,"Ok, I have added `AssertLockHeld(cs_main)`.\n",https://github.com/bitcoin/bitcoin/pull/6312#discussion_r42931264,42931264,src/main.cpp
NicolasDorier,2015-10-26T16:28:44Z,"By mistake I commented on the commit not PR, but here it seems it should be GetBlockTime() instead of GetMedianTimePast() or am I missing something ?\n",https://github.com/bitcoin/bitcoin/pull/6312#discussion_r43016421,43016421,src/main.cpp
afk11,2015-10-26T17:03:30Z,@NicolasDorier See https://github.com/bitcoin/bitcoin/pull/6566\n,https://github.com/bitcoin/bitcoin/pull/6312#discussion_r43021288,43021288,src/main.cpp
NicolasDorier,2015-10-26T17:05:19Z,"Pasting @maaku 's response on the commit :\n\n> No, GetMedianTimePast is preferred because it is not a free choice by the miner who included the transaction being spent. BIP 113 changes the other end of the interval for both nLockTime and nSequence to be GetMedianTimePast, which is a soft-fork change, but changing the start of the interval in that way would be a hard-fork change. So we start from ",https://github.com/bitcoin/bitcoin/pull/6312#discussion_r43021540,43021540,src/main.cpp
maaku,2015-11-12T05:16:18Z,This will access uninitialized memory beyond the stack on the genesis block.\n,https://github.com/bitcoin/bitcoin/pull/6312#discussion_r44622250,44622250,src/main.cpp
NicolasDorier,2015-11-12T06:39:51Z,"Good catch, I just fixed it on https://github.com/NicolasDorier/bitcoin/commit/eb2696281bd9bd13d0fca5c25e7c96969b5ef518\n\nIf you want to update this PR.\n",https://github.com/bitcoin/bitcoin/pull/6312#discussion_r44625635,44625635,src/main.cpp
btcdrak,2015-11-12T11:14:27Z,This has been updated.\n,https://github.com/bitcoin/bitcoin/pull/6312#discussion_r44645715,44645715,src/main.cpp
btcdrak,2015-11-20T19:37:19Z,"Bikeshedding myself but I think `SEQUENCE_LOCKTIME_SECONDS_FLAG` is not a good name because this flag determines the type of relative lock-time, i.e. timebased or block based. I wonder if `SEQUENCE_LOCKTIME_TYPE_FLAG` would be better.\n",https://github.com/bitcoin/bitcoin/pull/6312#discussion_r45508765,45508765,src/primitives/transaction.h
NicolasDorier,2015-11-21T07:50:35Z,"I agree on that, this got me confused as well\n",https://github.com/bitcoin/bitcoin/pull/6312#discussion_r45543033,45543033,src/primitives/transaction.h
CodeShark,2015-11-21T07:55:23Z,I also agree.\n,https://github.com/bitcoin/bitcoin/pull/6312#discussion_r45543070,45543070,src/primitives/transaction.h
jtimon,2015-11-30T20:33:05Z,why is this cast needed?\n,https://github.com/bitcoin/bitcoin/pull/6312#discussion_r46199226,46199226,src/main.cpp
maaku,2015-12-01T00:07:53Z,"Because otherwise you'd be doing a signed comparison and there'd be half\nthe range of nVersion that wouldn't support BIP 68.\n\nOn Tue, Dec 1, 2015 at 4:33 AM, Jorge Timón notifications@github.com\nwrote:\n\n> In src/main.cpp\n> https://github.com/bitcoin/bitcoin/pull/6312#discussion_r46199226:\n> \n> >  {\n> > -    if (tx.nLockTime == 0)\n> > -        return true;\n> > -    if ((int64_t)tx.nLock",https://github.com/bitcoin/bitcoin/pull/6312#discussion_r46223772,46223772,src/main.cpp
jtimon,2015-12-01T19:21:45Z,"Mhmm, I believe I have asked this before...maybe a comment here would be useful (although of course it can be added later).\n",https://github.com/bitcoin/bitcoin/pull/6312#discussion_r46324675,46324675,src/main.cpp
sipa,2015-12-01T19:22:57Z,Agree with @jtimon. This is not obvious.\n,https://github.com/bitcoin/bitcoin/pull/6312#discussion_r46324862,46324862,src/main.cpp
btcdrak,2015-12-02T18:57:38Z,I added a comment to explain the casting.\n,https://github.com/bitcoin/bitcoin/pull/6312#discussion_r46457637,46457637,src/main.cpp
