sipa,2015-11-19T12:07:19Z,"This is still using the ""if not found in chainstate, skip"" logic I was hoping to avoid in consensus logic...\n",https://github.com/bitcoin/bitcoin/pull/6312#issuecomment-158037757,158037757,
CodeShark,2015-11-19T12:12:16Z,"@sipa I agree we should get rid of that logic, but we really need to get something merged soon and perhaps it would be better to fix that issue in a separate PR.\n",https://github.com/bitcoin/bitcoin/pull/6312#issuecomment-158039395,158039395,
sipa,2015-11-19T12:16:25Z,@CodeShark But the logic to avoid it is there! It's just still using the wrapper inside consensus!\n,https://github.com/bitcoin/bitcoin/pull/6312#issuecomment-158041487,158041487,
sipa,2015-11-19T14:03:35Z,"@btcdrak Please have a look at https://github.com/sipa/bitcoin/commits/sequencenumbers. I added a commit that turns LockTime into a function that only takes in a height map of inputs, and CheckLockTime contain all mempool-specific logic (no intermediate-level LockTime function either).\n\nIt also avoids calling the inefficient GetCoins method on pcoinsTip in block validation, which would make a fu",https://github.com/bitcoin/bitcoin/pull/6312#issuecomment-158064883,158064883,
NicolasDorier,2015-11-19T15:53:43Z,"Reviewed d6ed8e6 this is good to me, I prefer the height map as well.\nAlthough, I think not having the wrapper make it less readable. What difference between GetCoins and AccessCoins ? if the problem was about performance, we could have used AccessCoins in the wrapper, it would spare us some code.\n\n@CodeShark I'm not against squashing anything, I just thought it was better for review to keep th",https://github.com/bitcoin/bitcoin/pull/6312#issuecomment-158098383,158098383,
sipa,2015-11-19T16:01:47Z,"@NicolasDorier Yes, performance. GetCoins copies. AccessCoins returns a reference. But you can only use AccessCoins on caches (so not on the mempoolview, for example).\n\nI'm not against leaving the wrapper, though I think it's better this way.\n",https://github.com/bitcoin/bitcoin/pull/6312#issuecomment-158100744,158100744,
NicolasDorier,2015-11-19T16:10:09Z,"I see, so it needs to be different at both places, if so, the wrapper does not help much so better keeping it this way.\n",https://github.com/bitcoin/bitcoin/pull/6312#issuecomment-158103024,158103024,
btcdrak,2015-11-19T17:06:16Z,"Okay, I've fixed up and squashed commits a bit according to @CodeShark and added @sipa commit. Is there anything else?\n",https://github.com/bitcoin/bitcoin/pull/6312#issuecomment-158120458,158120458,
jtimon,2015-11-19T18:17:34Z,https://github.com/sipa/bitcoin/commit/85db73bd6647aca391d6ad5d5b2524005d74e74c#commitcomment-14505603 \n\nhttps://github.com/sipa/bitcoin/commit/85db73bd6647aca391d6ad5d5b2524005d74e74c#commitcomment-14505448\n,https://github.com/bitcoin/bitcoin/pull/6312#issuecomment-158144292,158144292,
jtimon,2015-11-19T18:55:19Z,@sipa what about https://github.com/jtimon/bitcoin/commit/071bc1cf615c0528d4f7e2fe33dc80186da447d3 ? Is using size() == 0 instead of pointer == NULL to signal the special case.\n,https://github.com/bitcoin/bitcoin/pull/6312#issuecomment-158155193,158155193,
NicolasDorier,2015-11-20T04:51:08Z,"@jtimon I'm not sure but I think there are blocks in the past without input for the coinbase ? In such case they would be size() == 0, but this would have different semantic as point==NULL.\n\nAlso, I think expressing missing parameter with NULL is more common.\n",https://github.com/bitcoin/bitcoin/pull/6312#issuecomment-158279091,158279091,
sipa,2015-11-20T10:24:02Z,@Nicolas there is a consensus rule that all transactions (including\ncoinbases) have at least one input and one output.\n\nNo opinion otherwise.\n,https://github.com/bitcoin/bitcoin/pull/6312#issuecomment-158349825,158349825,
jtimon,2015-11-20T12:10:01Z,"Well, == NULL may be more common than .size.() == 0, but using a pointer instead of a reference unnecessarily complicates things for no good reason. Look at how many & from the callers we could remove if using a ref, for example. Any drawback that I'm missing? \n",https://github.com/bitcoin/bitcoin/pull/6312#issuecomment-158378943,158378943,
btcdrak,2015-11-20T17:42:36Z,@jtimon Thank you for taking time to consider options. After some discussions on IRC I have decided I not to merge  jtimon@071bc1c in this PR because it appears contentious and unnecessary.\n,https://github.com/bitcoin/bitcoin/pull/6312#issuecomment-158469883,158469883,
btcdrak,2015-11-22T05:26:44Z,Rebased due to conflicting changes in master.\n,https://github.com/bitcoin/bitcoin/pull/6312#issuecomment-158713348,158713348,
instagibbs,2015-11-24T02:28:56Z,"Carefully went through the latest draft of the BIP, and checked the related sections in this pull, especially LockTime(). Description and code lines up. \n",https://github.com/bitcoin/bitcoin/pull/6312#issuecomment-159133655,159133655,
jtimon,2015-11-30T18:51:07Z,re-utACK with the latest changes. Is there still anything holding this back?\n,https://github.com/bitcoin/bitcoin/pull/6312#issuecomment-160722578,160722578,
NicolasDorier,2015-12-01T15:46:59Z,@btcdrak I rebased on https://github.com/NicolasDorier/bitcoin/tree/sequencenumbers travis is happy.\n,https://github.com/bitcoin/bitcoin/pull/6312#issuecomment-161006447,161006447,
afk11,2015-12-02T05:16:42Z,Needs rebase\n,https://github.com/bitcoin/bitcoin/pull/6312#issuecomment-161184595,161184595,
NicolasDorier,2015-12-02T15:21:44Z,"@sipa a rewrite has been done by #6898 makes it impossible to call LockTime by passing the prevHeights. (because all calls to the CCoinsView have been remove)\nI have the feeling that fetching the prevHeights by using the view to fix the problem will kill the perf improvement made by #6898, making it irrrelevant.\n\n@morcos can you advise ? The problem is that we call LockTime (which was IsFinalTx",https://github.com/bitcoin/bitcoin/pull/6312#issuecomment-161330530,161330530,
sipa,2015-12-02T15:25:41Z,We'll need to store the input's heights inside the mempool entries. I don't\nthink that's hard.\n,https://github.com/bitcoin/bitcoin/pull/6312#issuecomment-161331612,161331612,
NicolasDorier,2015-12-02T15:31:17Z,"ok sorry, it seems to be stored already... trying that out.\n",https://github.com/bitcoin/bitcoin/pull/6312#issuecomment-161333413,161333413,
morcos,2015-12-02T16:12:38Z,"@NicolasDorier Ah, I hadn't realized that we wouldn't be able to merge #6312 until we worked on the efficient way of doing that.\n\n@sipa Why not just make the mempool be consistent with finality of txs so we don't have to check that any more in CreateNewBlock.  This is what we discussed in #6915, we only need to store one height, which is the max of the height the tx is viable for coinbase maturi",https://github.com/bitcoin/bitcoin/pull/6312#issuecomment-161348915,161348915,
NicolasDorier,2015-12-02T16:34:52Z,"I tried to modify sipa's commit to adapt on https://github.com/NicolasDorier/bitcoin/commit/33254c779baa365f15af74074e66f620388a5e5e#diff-4a59b408ad3778278c3aeffa7da33c3cL142 but it is not good it fails \n\n```\ntest_bitcoin: main.cpp:666: int64_t LockTime(const CTransaction&, int, const std::__debug::vector<int>*, const CBlockIndex&): Assertion `prevHeights == __null || prevHeights->size() == tx.",https://github.com/bitcoin/bitcoin/pull/6312#issuecomment-161357278,161357278,
NicolasDorier,2015-12-02T16:45:24Z,@morcos AFAIK a transaction is not accepted into mempool if finality does not pass. [Link](https://github.com/NicolasDorier/bitcoin/blob/sequencenumbers/src/main.cpp#L1040)\n\nSo maybe preheights are not needed at all and we can just pass NULL to LockTime() or even not checking at all. Someone can confirm ?\n,https://github.com/bitcoin/bitcoin/pull/6312#issuecomment-161360196,161360196,
sipa,2015-12-02T16:48:17Z,"Right now I believe that during a reorg the finality of transactions can\ntheoretically get violated (because the chain height can go down, though\nthis is very unlikely). So we'd need to evaluate finality upon disconnect\nif we want to remove finality checking from CNB.\n",https://github.com/bitcoin/bitcoin/pull/6312#issuecomment-161361107,161361107,
NicolasDorier,2015-12-02T16:52:03Z,How can a reorg can make the chain height go down ?\nI thought the only way a reorg could happen was if a longest chain was discovered.\n,https://github.com/bitcoin/bitcoin/pull/6312#issuecomment-161362206,161362206,
instagibbs,2015-12-02T16:54:41Z,@NicolasDorier more total work not height\n,https://github.com/bitcoin/bitcoin/pull/6312#issuecomment-161362911,161362911,
morcos,2015-12-02T16:58:50Z,"@NicolasDorier It's also whether the height went below the height that each of the previous inputs was confirmed at, because they may have changed height, even if the reorg finished at a higher height.\n",https://github.com/bitcoin/bitcoin/pull/6312#issuecomment-161364108,161364108,
morcos,2015-12-02T17:02:56Z,"@NicolasDorier Looking briefly at your branch, you seem to be looking at the heights of the mempool parents.  Thats not the same thing as looking at all the parents.  \n",https://github.com/bitcoin/bitcoin/pull/6312#issuecomment-161365249,161365249,
NicolasDorier,2015-12-02T17:04:20Z,"Ok, I understand. Checking finality during reorg is better done in a separate PR, or can we try to squeeze it into this one ?\n\nSeems like best to do that than trying to fetch heights in CNB like I tried.\n",https://github.com/bitcoin/bitcoin/pull/6312#issuecomment-161365632,161365632,
morcos,2015-12-02T17:17:43Z,"I think probably the right thing to do is fetch heights in CNB the slow and correct way for this pull.  And then have a separate pull that properly calculates finality in a reorg and we can then remove that code from CNB.   We should make sure to do the 2nd step before releasing 0.12.1 though, otherwise we'll have a serious regression in CNB performance.\n",https://github.com/bitcoin/bitcoin/pull/6312#issuecomment-161369495,161369495,
btcdrak,2015-12-02T18:42:23Z,This has been rebase (by @NicolasDorier) \n,https://github.com/bitcoin/bitcoin/pull/6312#issuecomment-161393859,161393859,
NicolasDorier,2015-12-02T18:44:01Z,I did as @morcos [advised](https://github.com/maaku/bitcoin/commit/6bf228e4c3fad67578e5ecea3275aae2afbafdd0#diff-4a59b408ad3778278c3aeffa7da33c3cL142). It will be easy to get rid off once finality is enforced in mempool.\n\nAlso I had to adapt CheckLockTime [here](https://github.com/maaku/bitcoin/commit/deedf00b9615b3557428e55c01f5e2ba6aa151cd#diff-ca74c4b28865382863b8fe7633a85cd6L507) because of ,https://github.com/bitcoin/bitcoin/pull/6312#issuecomment-161394272,161394272,
maaku,2015-12-03T00:52:26Z,"@NicolasDorier longest-chain means most-work, not most-blocks. Think about a reorg that crosses drastically different difficulty adjustments.\n\nBut while such edge cases should be properly handled, I wouldn't want you to waste your time trying to get the checks in CNB removed. Such a change will be nack'd. Those checks exist because we've had mempool inconsistencies in the past, and we will have ",https://github.com/bitcoin/bitcoin/pull/6312#issuecomment-161480583,161480583,
NicolasDorier,2015-12-03T03:20:56Z,"@maaku I understand for the chain, I indeed thought longest chain was ""more blocks"".\nIt is a bit a shame that it breaks the perf improvement that @morcos spent time to fix though.\n\nWhat I propose to keep CNB while having perf improvement, is to save in mempool entry the highest blockid at the time of AcceptToMempool after the finality check. In CNB if the blockid of the mempool entry is not in ",https://github.com/bitcoin/bitcoin/pull/6312#issuecomment-161504584,161504584,
morcos,2015-12-03T04:04:05Z,"@maaku The evolution of CreateNewBlock has been to not do any checks.  It now depends on the mempool's consistency for everything other than finality of txs.  Adding finality of txs is next.\n\n@NicolasDorier What @sdaftuar and I are already working on is a variation of what you are proposing.  Our idea is to keep the mempool consistent so CNB never has to do any finality checks, so on a reorg you",https://github.com/bitcoin/bitcoin/pull/6312#issuecomment-161509206,161509206,
btcdrak,2015-12-03T04:08:53Z,There was some conversation about CNB today [here](https://botbot.me/freenode/bitcoin-core-dev/2015-12-02/?msg=55319745&page=5)\n,https://github.com/bitcoin/bitcoin/pull/6312#issuecomment-161509625,161509625,
NicolasDorier,2015-12-03T04:56:12Z,"> You will do this by storing the height and time at which the entry is final, and only recalculating if the reorg dropped below that height (or for added efficiency if the reorg dropped below the height necessary to calculate those heights).\n\nDoing such thing would be a bug. Because even if the reorg does not drop below the height, the FinalTx may be invalidated. (the ""blocktime"" in LockTime() ",https://github.com/bitcoin/bitcoin/pull/6312#issuecomment-161514071,161514071,
morcos,2015-12-03T13:45:04Z,"@NicolasDorier yes I was just describing the basic idea, you still have to recheck the locktime (height or time) and the sequence (height and time) for every tx in the mempool.  what you want to do is make those checks quick.  locktime is always quick, if we only recalculate the sequence validity height and time only when necessary then we'll achieve our goal.\n",https://github.com/bitcoin/bitcoin/pull/6312#issuecomment-161643464,161643464,
jtimon,2015-12-03T18:18:09Z,"> or can we try to squeeze it into this one ?\n\nAt some point we will hopefully stop improving this PR and finally merge it. It was my belief that the plan was to do it before 0.12, but 6 months after the functionality was first implemented and more than 5 months after the PR was created (now) seems as good of a time as any other. That doesn't mean we can't keep improving the code later, but it w",https://github.com/bitcoin/bitcoin/pull/6312#issuecomment-161737102,161737102,
sipa,2015-12-03T18:20:35Z,"As discussed in the weekly meetings several times, several people are not\nconfortable that the BIP has had sufficient review. We can't merge unless\nit won't change anymore.\n",https://github.com/bitcoin/bitcoin/pull/6312#issuecomment-161737782,161737782,
jtimon,2015-12-03T18:29:59Z,I thought the mismatch between the BIP and the code had been solved. But I completely agree on it stop changing so that it can be merged.\nI like @NicolasDorier and @sipa 's included changes but in my opinion the PR already had too many ACKs when they were added and that's what I mean with improvements that could have been done later.\n,https://github.com/bitcoin/bitcoin/pull/6312#issuecomment-161740190,161740190,
NicolasDorier,2015-12-03T21:17:04Z,"Ok let's freeze it now so people can review and ACK. Btw, I am tempted to make LockTime() returns 0 for the coinbase transaction explicitly.\nIn ConnectBlock, finality is not tested for the coinbase, but for some reason it is tested in CNB since #6898 [Link](https://github.com/bitcoin/bitcoin/pull/6898/files#diff-4a59b408ad3778278c3aeffa7da33c3cL171). Returning 0 explicitly if we pass coinbase to ",https://github.com/bitcoin/bitcoin/pull/6312#issuecomment-161787258,161787258,
jtimon,2015-12-03T21:59:01Z,@NicolasDorier I'll happily review any further improvements once this is merged.\n,https://github.com/bitcoin/bitcoin/pull/6312#issuecomment-161798065,161798065,
NicolasDorier,2015-12-03T22:22:36Z,Woops sorry... reflex. Review time ! :)\n,https://github.com/bitcoin/bitcoin/pull/6312#issuecomment-161804623,161804623,
jtimon,2015-12-03T22:59:44Z,@NicolasDorier In the meantime...there's another function that could benefit from the kind of work that has been put in this PR lately that could use some of the same ideas: Consensus::CheckTxInputs in main.cpp currently has a `const CCoinsViewCache&` parameter and I would happily review any attempt to change that fact. Just saying...\n,https://github.com/bitcoin/bitcoin/pull/6312#issuecomment-161816393,161816393,
morcos,2015-12-04T04:40:20Z,This is what I had in mind: https://github.com/maaku/bitcoin/compare/sequencenumbers...morcos:refactorb\n\nIt's still missing commits to properly recalculate the LockPoints after a reorg and to remove the checking of LockTime in CreateNewBlock.  However I wanted to see if this is the direction people want to go?\n,https://github.com/bitcoin/bitcoin/pull/6312#issuecomment-161873626,161873626,
NicolasDorier,2015-12-04T08:11:26Z,"It is a good idea I think, but it should better be done in a separate PR. This one is already a monster shaky PR, every time someone commit into master, I need to rebase. Would like to flush the PR. :(\n",https://github.com/bitcoin/bitcoin/pull/6312#issuecomment-161905138,161905138,
btcdrak,2015-12-04T10:30:33Z,@NicolasDorier I think @morcos idea should be added to this PR. I'm happy to cherry-pick. This was also echoed in the IRC meeting yesterday.\n,https://github.com/bitcoin/bitcoin/pull/6312#issuecomment-161932079,161932079,
jtimon,2015-12-04T13:03:33Z,"It would be nice if the people who are in favor to keep changing this would voice it here for those of us who missed the meeting. I think the meeting should be a complement but not a replacement to discussion in github for obvious traceability reasons.\nPersonally, I won't have time to re-utACK this if we cherry pick more things in. And many of the earlier acks haven't been repeated after the late",https://github.com/bitcoin/bitcoin/pull/6312#issuecomment-161962412,161962412,
morcos,2015-12-04T13:35:03Z,@NicolasDorier The only thing that I'd argue should be added to this PR is the change to the consensus functions.  The first commit from my branch and maybe the change to CheckLockTime from the second.  The other changes should be in a separate PR that is backported only to 0.12 (but before the point release that contains this PR)\n\nI wanted to show the version that has the fewest changes from th,https://github.com/bitcoin/bitcoin/pull/6312#issuecomment-161969262,161969262,
jtimon,2015-12-04T13:49:51Z,@morcos can you summarize  what is the problem that your proposed changes are supposed to solve again? \n,https://github.com/bitcoin/bitcoin/pull/6312#issuecomment-161972302,161972302,
sipa,2015-12-04T13:59:53Z,"This patch makes CNB fetch data from the UTXO set again, nullifying the\nperformance improvement we got from the rewrite.\n",https://github.com/bitcoin/bitcoin/pull/6312#issuecomment-161974416,161974416,
jtimon,2015-12-04T14:14:44Z,"Then maybe it would have been a good idea to have merged this first before merging the CNB optimization rewrite(much newer code than this, btw), but anyway, too late for that.\nI fail to see how https://github.com/maaku/bitcoin/compare/sequencenumbers...morcos:refactorb solves the issue without touching miner.cpp, but that may be because I haven't reviewed the CNB in much detail.\nThank you for th",https://github.com/bitcoin/bitcoin/pull/6312#issuecomment-161977636,161977636,
NicolasDorier,2015-12-04T17:09:09Z,"@morcos, on my side, I'm just getting tired of rebasing every time something change on master. I'll do anything to get that merged. I'll pay ACKs in beers for those coming in HK... And make them drink until they give the ACK. :p\n\nI quickly reviewed your commits : I don't understand the purpose of the structure update_lock_points.\nI fear also that we will again need to update the BIPs explaining",https://github.com/bitcoin/bitcoin/pull/6312#issuecomment-162023767,162023767,
morcos,2015-12-04T20:30:33Z,(EDITED)\nOK I updated https://github.com/maaku/bitcoin/compare/sequencenumbers...morcos:refactorb to be a slightly different refactoring.\n\nThe first two commits are bug fixes for the unit tests.\nThe third commit is a minor refactor of LockTime to get access to the critical variables.\nThe fourth commit uses that refactor to store LockPoints in CTxMemPoolEntries.\nThe fifth commit keeps LockPoi,https://github.com/bitcoin/bitcoin/pull/6312#issuecomment-162073725,162073725,
jtimon,2015-12-04T22:33:13Z,"@morcos what is exactly the problem with leaving all your commits for the next PR instead of putting ""half of the change"" here?\nNow I see why I wasn't able to understand how your code fixes cnb (the goal of the changes), it doesn't yet!\n\nI think it's better to put the preparation commits in the same PR when the preparations are actually going to be used when possible (ie when this doesn't resul",https://github.com/bitcoin/bitcoin/pull/6312#issuecomment-162100632,162100632,
morcos,2015-12-04T22:35:27Z,@NicolasDorier OK I think I'm done.  I edited the above message to reflect the final branch.\n,https://github.com/bitcoin/bitcoin/pull/6312#issuecomment-162101014,162101014,
morcos,2015-12-04T22:37:38Z,"@jtimon Yeah that actually might be fine.  I think the question is how much are we going to refactor the consensus code.  This turns out to be a relatively minor refactor, but we might decide to do a more significant one instead.  Since this is all new consensus code, it makes sense to get it right the first time so that we don't have to change it again in the future, and so that the backported to",https://github.com/bitcoin/bitcoin/pull/6312#issuecomment-162101412,162101412,
NicolasDorier,2015-12-05T11:02:06Z,"I prefered your previous commits CalculateLocks should returns information direclty into LockPoint datastructure, so we don't have to make the mapping.\nAlso I think it is hard to review right now and I guess, @maaku was not so eager to remove locktime check in CNB.\n\nHow about a simpler change : We store a bool called ""LockTimeChecked"" in the mempool entry, then when there is a reorg (which is t",https://github.com/bitcoin/bitcoin/pull/6312#issuecomment-162172692,162172692,
jtimon,2015-12-05T11:41:23Z,@NicolasDorier sounds like a nice and easy way to solve the CNB performance problem without having to touch the consensus code further and without having it depend on new structures.\n\nLet's have a thought experiment. Let's say this was merged with morcos' preparations for his solution but without the actual solution for CNB. Let's say @NicolasDorier had had the odea only after merging morcos' pr,https://github.com/bitcoin/bitcoin/pull/6312#issuecomment-162175137,162175137,
sipa,2015-12-05T11:46:04Z,I think there's a good argument for trying to get the code to a point where it's easily merged both in 0.12 and older branches.\n,https://github.com/bitcoin/bitcoin/pull/6312#issuecomment-162175293,162175293,
morcos,2015-12-05T12:40:02Z,"@NicolasDorier By all means please try another approach.  @sdaftuar was also working on a slight variation, that I originally thought might be better than this, although now I think this is better.  I'm not sure which code changes you aren't comfortable with though.  I believe the changes to #6312 are very minimal, again its only the 3rd commit that changes consensus code.  The original commits we",https://github.com/bitcoin/bitcoin/pull/6312#issuecomment-162178538,162178538,
btcdrak,2015-12-05T12:41:40Z,"For the record, @ajtowns has been working on some exotic HTLC functional demos using my #6312+#6564 branch which will help allay fears about the lack of tested ACKs (which is the real reason for delay). It will also help protect against regression if we need to change anything.\n\nThis PR has to be backported to 0.11 and 0.12, so we need to take that into consideration. So long as we have good fun",https://github.com/bitcoin/bitcoin/pull/6312#issuecomment-162178597,162178597,
btcdrak,2015-12-05T12:42:24Z,@morcos I've cherry-picked the bug fixes as a first step.\n\nEDIT: squashed morcos/bitcoin@71922fb and morcos/bitcoin@0bc5b84 into 4a01034\n,https://github.com/bitcoin/bitcoin/pull/6312#issuecomment-162178620,162178620,
jtimon,2015-12-05T15:08:15Z,"@morcos yeah, my point is that with either add the final solution or nothing at all.\nMy preference would be nothing at all and doing the ""final solution"" in another PR (and also backport that, at least to 0.12 which has the rewritten CNB), but if everybody else prefers to do the 2 different things in this one PR, I won't say anything else on the subject.\nI just don't see the backport advantage o",https://github.com/bitcoin/bitcoin/pull/6312#issuecomment-162210301,162210301,
NicolasDorier,2015-12-05T16:04:58Z,"@morcos not for this PR, but what would you say about another PR after this one for : https://github.com/NicolasDorier/bitcoin/commit/b13f47535cc24304176dfb9cd3f12511cf095055 \n",https://github.com/bitcoin/bitcoin/pull/6312#issuecomment-162216400,162216400,
NicolasDorier,2015-12-06T01:15:48Z,Just created an issue so we can debate without polluting here https://github.com/bitcoin/bitcoin/issues/7176\n,https://github.com/bitcoin/bitcoin/pull/6312#issuecomment-162261671,162261671,
NicolasDorier,2015-12-06T07:39:36Z,"Let me apologize if I seem to have put pressure or lost my nerves, about getting tired of rebasing and wanting csv, it is not the case. Lots of you had way more pressure than me, and I've not been really conscious about it, I'll rebase when there is a need to.\n",https://github.com/bitcoin/bitcoin/pull/6312#issuecomment-162285075,162285075,
morcos,2015-12-09T03:10:34Z,"@NicolasDorier Is there a reason you calculated the prevheights directly in CreateNewBlock instead of just calling CheckLockTime there?  I'm just thinking about the best way to back port this to 0.11, which will have no choice but to be slow in CreateNewBlock.\n",https://github.com/bitcoin/bitcoin/pull/6312#issuecomment-163091795,163091795,
