instagibbs,2020-02-28 15:16:33,Can you explain the code path master is hitting? Mind sharing the PSBT? :),https://github.com/bitcoin/bitcoin/pull/18220#issuecomment-592557996,592557996,
Sjors,2020-02-28 15:23:53,"Just try with a ColdCard simulator, it's pretty reproducible. On master `result.next` is set to `SIGNER` because `only_missing_sigs` is checked before `only_missing_final`. The latter is set to `true` along with the _input_ being marked as `FINALIZER`.\n\nThe reason master doesn't check `only_missing_final` first is that it starts as `false` and can be toggled to `true` for _any_ input. So I rev",https://github.com/bitcoin/bitcoin/pull/18220#issuecomment-592561234,592561234,
instagibbs,2020-02-28 15:31:52,If it's really easy to set up I think a checked in test is in order,https://github.com/bitcoin/bitcoin/pull/18220#issuecomment-592564844,592564844,
Sjors,2020-02-28 15:57:37,I added a test.,https://github.com/bitcoin/bitcoin/pull/18220#issuecomment-592576259,592576259,
instagibbs,2020-02-28 16:28:34,I had such trouble understanding the function I decided a proper refactor of logic was in order: https://github.com/bitcoin/bitcoin/pull/18224,https://github.com/bitcoin/bitcoin/pull/18220#issuecomment-592590154,592590154,
