paveljanik,2015-03-18T21:20:57Z,"I will not comment about the change itself...\n\nBut this will fail:\n\n```\n    BOOST_CHECK_EQUAL(AmountFromValue(ValueFromString(""20999999.9999999"")), 2099999999999990LL);\n```\n\nand as tests fail, this is sure NACK. The commit message contains typo (CAmout) etc.\n",https://github.com/bitcoin/bitcoin/pull/5925#issuecomment-83183825,83183825,
ghost,2015-03-18T21:28:19Z,"Thanks for pointing out the typo. \n\nThe tx_valid.json raw txs are spending 2100000000000000 and will need to be corrected accordingly themselves, in addition to the ones you pointed out.\n",https://github.com/bitcoin/bitcoin/pull/5925#issuecomment-83186329,83186329,
laanwj,2015-03-19T07:09:24Z,NACK. Too risky and controversial to change this.\n,https://github.com/bitcoin/bitcoin/pull/5925#issuecomment-83375508,83375508,
ghost,2015-03-19T20:26:38Z,"I hope it is obvious the risk and controversy lie in the flawed accounting practice, not its correction.\n",https://github.com/bitcoin/bitcoin/pull/5925#issuecomment-83751981,83751981,
ghost,2015-03-28T18:09:49Z,@paveljanik: The related tests have now been updated accordingly: https://github.com/21E14/bitcoin/commit/6f1278e62312384c7e5966030eaa4f05fe68b63a\n,https://github.com/bitcoin/bitcoin/pull/5925#issuecomment-87275188,87275188,
sipa,2015-03-28T19:37:29Z,"I think this reinforces a misunderstanding about what this constant does.\n\nThe total number of BTC will never exceed 20999839.74826098, due to provably unspendable outputs, overwritten coinbase transactions (see BIP30), unclaimed subsidies (see block 124724), and the unspendable genesis block output. So your number is still not accurate.\n\nThe point is, this constant doesn't do anything but pre",https://github.com/bitcoin/bitcoin/pull/5925#issuecomment-87290806,87290806,
ghost,2015-03-29T06:41:42Z,"I would almost agree with the spirit of the concluding remark. In this instance, inaction is the least preferable option for the reasons cited. The answer to the often brought up theme of max supply ought to be unambiguos. Erroneously, the current constant fails at that, reinforcing the misunderstanding in absurd contexts.\n\nThe value ought to be either aligned with the supply i.e. there will nev",https://github.com/bitcoin/bitcoin/pull/5925#issuecomment-87364287,87364287,
laanwj,2015-04-02T08:43:55Z,"Apart from philosophical reasons there seems to be no motivation for changing this constant. Even if there is little risk, there is no gain to be had. That's a good reason to leave it as is.\n\nIf your purpose is to avoid that people misinterpret it, adding a comment explaining the (non-) use of the constant would do just as well.\n",https://github.com/bitcoin/bitcoin/pull/5925#issuecomment-88828546,88828546,
ghost,2015-04-02T17:01:12Z,"@laanwj: The sole purpose of two test cases in /src/test/data is to successfully spend more BTC than will ever be mined, and the raw tx data is carefully constructed to make sure the overspend goes smoothly. I am not sure how to explain or comment it away, but am open to suggestions.\n",https://github.com/bitcoin/bitcoin/pull/5925#issuecomment-88975008,88975008,
