gavinandresen,2012-05-25T16:06:19Z,"Is this thread safe?  What if the thread executing the if (txnode) is interrupted after the if test, could another thread wake up and set txnode=NULL ?\n\nNACK in general-- too many code changes, the risks outweigh the (minimal) benefits.\n",https://github.com/bitcoin/bitcoin/pull/1375#issuecomment-5934134,5934134,
luke-jr,2012-05-26T02:48:36Z,"NACK, example of bad use of a global IMO\n",https://github.com/bitcoin/bitcoin/pull/1375#issuecomment-5943932,5943932,
rebroad,2012-05-29T08:47:48Z,"@gavinandresen It's thread safe unless some future change tries to change the value of txnode from a different thread. So far, only one thread uses txnode, so the value won't get changed between the test and the use.\n\n@luke-jr - thanks for the feedback. How would you recommend doing it? I realise I could just add one line in ProcessMessage() to log the peer against the tx, but I guess my motivat",https://github.com/bitcoin/bitcoin/pull/1375#issuecomment-5978397,5978397,
sipa,2012-05-29T10:13:41Z,"You're right that currently txnode is only set in ProcessMessage, which is only used in a single thread. But I agree it's a bad use of a global. If you really need to know who sent it, pass it along in arguments, or only report the offender from functions that do know.\n\nNot worth it, imho.\n",https://github.com/bitcoin/bitcoin/pull/1375#issuecomment-5979816,5979816,
rebroad,2012-05-29T14:38:43Z,"@sipa I did try passing it in arguments, but I was getting errors about incorrect number of arguments. Perhaps my understanding of C++ isn't quite sufficient.. :-s Is there any way to restrict the use of txnode so that it can't be used by other threads?\n",https://github.com/bitcoin/bitcoin/pull/1375#issuecomment-5985268,5985268,
luke-jr,2012-05-29T14:43:51Z,Too bad C++ doesn't have Perl's locals ;)\n,https://github.com/bitcoin/bitcoin/pull/1375#issuecomment-5985441,5985441,
jgarzik,2012-08-01T16:31:08Z,"Consensus: not worth it, closing\n",https://github.com/bitcoin/bitcoin/pull/1375#issuecomment-7432292,7432292,
