Diapolo,2013-04-28T16:22:45Z,"Currently testing this, I did a full IBD from one of sipas nodes, now a -reindex is running and I'll do another -reindex with a -dbcache of 1024! Will report my findings here and on IRC.\n",https://github.com/bitcoin/bitcoin/pull/2589#issuecomment-17136725,17136725,
BitcoinPullTester,2013-04-28T16:48:11Z,"Automatic sanity-testing: PASSED, see http://jenkins.bluematt.me/pull-tester/551b367f19dce1951362a1f9911004e583732376 for binaries and test log.\nThis test script verifies pulls every time they are updated. It, however, dies sometimes and fails to test properly.  If you are waiting on a test, please check timestamps to verify that the test.log is moving at http://jenkins.bluematt.me/pull-tester/cu",https://github.com/bitcoin/bitcoin/pull/2589#issuecomment-17137209,17137209,
Diapolo,2013-04-28T17:16:58Z,"First -reindex finished without errors, now a reindex with -dbcache=1024 is running.\n",https://github.com/bitcoin/bitcoin/pull/2589#issuecomment-17137762,17137762,
Diapolo,2013-04-28T18:55:32Z,"Second -reindex finished without errors :), ACK from my side.\n",https://github.com/bitcoin/bitcoin/pull/2589#issuecomment-17140234,17140234,
gavinandresen,2013-04-29T13:28:29Z,"Changes look good to me, ACK (I didn't test, though).\n",https://github.com/bitcoin/bitcoin/pull/2589#issuecomment-17166366,17166366,
Diapolo,2013-04-29T16:21:59Z,Any chance this can be pushed upstream into the main LevelDB code? Perhaps Google is interested ^^.\n,https://github.com/bitcoin/bitcoin/pull/2589#issuecomment-17177264,17177264,
sipa,2013-04-29T23:36:00Z,"@Diapolo The win32 env code is not part of upstream LevelDB. If it matures a bit more, we may try to get it merged though.\n",https://github.com/bitcoin/bitcoin/pull/2589#issuecomment-17201399,17201399,
