laanwj,2014-03-07T07:15:06Z,"The drawback is that years/months have very large granularity, ie you cannot see progress in the beginning.\nMonths also don't seem to be a good measure of time to me as they vary wildly in length.\n\nWhat about:\n- ""%n week(s)"" if <=1 year\n- ""%n year(s) and %n week(s)"" if >1year\n",https://github.com/bitcoin/bitcoin/pull/3811#issuecomment-36973246,36973246,
thegreatnegel,2014-03-07T07:35:07Z,"That's fair, I'll add a more sentient line of code tomorrow to take into account the granularity of months and years (i.e %years == months + years)\n",https://github.com/bitcoin/bitcoin/pull/3811#issuecomment-36974116,36974116,
BitcoinPullTester,2014-03-07T08:09:26Z,"Automatic sanity-testing: FAILED BUILD/TEST, see http://jenkins.bluematt.me/pull-tester/c1b9b414228c2d78ee109cdd0d92f4c4a1e8cc37 for binaries and test log.\n\nThis could happen for one of several reasons:\n1. It chanages paths in makefile.linux-mingw or otherwise changes build scripts in a way that made them incompatible with the automated testing scripts (please tweak those patches in qa/pull-tes",https://github.com/bitcoin/bitcoin/pull/3811#issuecomment-36975758,36975758,
laanwj,2014-03-07T09:05:04Z,"I'd still prefer weeks and years, and leaving out the months.\n",https://github.com/bitcoin/bitcoin/pull/3811#issuecomment-36978955,36978955,
laanwj,2014-03-15T09:18:18Z,See #3876\n,https://github.com/bitcoin/bitcoin/pull/3811#issuecomment-37721309,37721309,
thegreatnegel,2014-03-17T07:32:34Z,"Thanks for the update! I was wondering why mine failed the sanity test, I\nmissed updating the qt locales file. Muchos gracias!\n\nOn Sat, Mar 15, 2014 at 2:18 AM, Wladimir J. van der Laan <\nnotifications@github.com> wrote:\n\n> See #3876 https://github.com/bitcoin/bitcoin/pull/3876\n> \n> ## \n> \n> Reply to this email directly or view it on GitHubhttps://github.com/bitcoin/bitcoin/pull/3811#iss",https://github.com/bitcoin/bitcoin/pull/3811#issuecomment-37790489,37790489,
laanwj,2014-03-07T07:11:18Z,"The average number of seconds in a month, taking into account leap years, is 2629800 (=(365+365+365+366) \* 24 \* 60 \* 60 / 4 / 12)\n",https://github.com/bitcoin/bitcoin/pull/3811#discussion_r10374994,10374994,src/qt/bitcoingui.cpp
laanwj,2014-03-07T07:19:37Z,"The average number of seconds in a year is closer to (365+365+365+366) \* 24 \* 60 \* 60 / 4 = 31557600\n(which is still not entirely precise due to handling of leap years around the centuries, but it's better than just '52 weeks')\n",https://github.com/bitcoin/bitcoin/pull/3811#discussion_r10375098,10375098,src/qt/bitcoingui.cpp
