gavinandresen,2011-04-15T15:22:07Z,Please start a thread on the forums about this (if you haven't already): http://www.bitcoin.org/smf/index.php?board=6.0\n,https://github.com/bitcoin/bitcoin/pull/160#issuecomment-1008020,1008020,
CAFxX,2011-04-15T17:34:22Z,http://www.bitcoin.org/smf/index.php?topic=5888.0\n,https://github.com/bitcoin/bitcoin/pull/160#issuecomment-1009016,1009016,
gavinandresen,2011-05-01T13:46:26Z,Did you test calling this from command-line bitcoind?  I don't see a call to ConvertTo down around line 2090 of rpc.cpp to convert the third param from a string to an integer.\n,https://github.com/bitcoin/bitcoin/pull/160#issuecomment-1083248,1083248,
CAFxX,2011-05-07T16:36:43Z,"whoops! nope, I didn't test the command-line. fixed.\n",https://github.com/bitcoin/bitcoin/pull/160#issuecomment-1115775,1115775,
gavinandresen,2011-05-09T18:04:00Z,"In the future, please test your patches before submitting.  This broke the build, and the feature was broken, too.\n",https://github.com/bitcoin/bitcoin/pull/160#issuecomment-1125174,1125174,
CAFxX,2011-05-09T20:14:12Z,"Fixed and tested (linux-x64). You may want to pull because I also forgot to change the number of incoming parameters (see https://github.com/CAFxX/bitcoin/commit/80d9115d9820a884955e82db7d41662c4dd53758#L0R1085 )\nSorry about the breakage, I assumed a number of things that in the end turned out to be quite different.\n",https://github.com/bitcoin/bitcoin/pull/160#issuecomment-1125950,1125950,
