jnewbery,2017-05-01T21:35:04Z,"utACK 0300d5e556cc1556b9cba1ec11ff3eef47bddca5.\n\nCan you add a test to exercise the new functionality? Perhaps add some calls to `getrawmempool` with specified txids to the mempool_reorg test. Around here: https://github.com/bitcoin/bitcoin/blob/e2b99b13131b5d0fd6fae6d55892c2ebb327d438/test/functional/mempool_reorg.py#L88",https://github.com/bitcoin/bitcoin/pull/10304#issuecomment-298439060,298439060,
sipa,2017-05-01T22:49:17Z,I believe this functionality already exists as `getmempoolentry`.,https://github.com/bitcoin/bitcoin/pull/10304#issuecomment-298453273,298453273,
kallewoof,2017-05-02T00:31:41Z,"@sipa Indeed, I had completely missed that one. I'm surprised there's a whole command for it, personally. (And it doesn't seem to be well known as several people (me, issue author, ..) did not realize it, so it may be an idea to mention it in getrawmempool help.)",https://github.com/bitcoin/bitcoin/pull/10304#issuecomment-298468072,298468072,
paveljanik,2017-05-04T07:01:25Z,"Thinking a bit more about it, `gettransaction` should be generalised to include not only in-wallet transactions, but also in-mempool txs. as we have in-wallet, in-blockchain/non-wallet and in-mempool txs (why entries?). But this is backward incompatible change in the API.",https://github.com/bitcoin/bitcoin/pull/10304#issuecomment-299110736,299110736,
sipa,2017-05-04T07:58:41Z,"@paveljanik We have `getrawtransaction` for that, which can query for mempool transactions (and without `-txindex`, that's pretty much the only thing it is useful for).\n\nI disagree that `gettransaction` should be extended. Despite its name, `gettransaction` actually does not return information about a transaction, but is a wallet RPC that returns information about a ledger entry (i.e., the eff",https://github.com/bitcoin/bitcoin/pull/10304#issuecomment-299119781,299119781,
