DrahtBot,2019-10-29 20:06:52,<!--e57a25ab6845829454e8d69fc972939a-->\n\nThe following sections might be updated with supplementary metadata relevant to reviewers and maintainers.\n\n<!--174a7506f384e20aa4161008e828411d-->\n### Conflicts\nNo conflicts as of last run.,https://github.com/bitcoin/bitcoin/pull/17305#issuecomment-547606194,547606194,
fanquake,2019-10-29 21:43:58,@birtony You need to remove any trailing whitespace and [squash your commits](https://github.com/bitcoin/bitcoin/blob/master/CONTRIBUTING.md#squashing-commits).,https://github.com/bitcoin/bitcoin/pull/17305#issuecomment-547643308,547643308,
fanquake,2020-03-23 01:53:18,No longer up for grabs (#18391).,https://github.com/bitcoin/bitcoin/pull/17305#issuecomment-602321467,602321467,
MarcoFalke,2019-10-29 19:22:21,"This is not true. It depends on the parameter interaction. I'd rather describe that here.\n\nAlso you'd need to update doc/low_bandwith.md or whatever it is called",https://github.com/bitcoin/bitcoin/pull/17305#discussion_r340279161,340279161,src/init.cpp
birtony,2019-10-29 19:26:20,"Hey @MarcoFalke, I am sorry for my mistake, and thanks for your comments. Should I put it as the following?\n> Whether to reject transactions from network peers. Transactions from the wallet, RPC and relay whitelisted inbound peers might be affected depending on the parameter interaction.",https://github.com/bitcoin/bitcoin/pull/17305#discussion_r340280836,340280836,src/init.cpp
birtony,2019-10-29 21:42:28,"@MarcoFalke I have made an update which includes your remarks in a333b82. Please, let me know if it is correct?",https://github.com/bitcoin/bitcoin/pull/17305#discussion_r340340116,340340116,src/init.cpp
MarcoFalke,2019-10-30 00:53:12,"As a user reading this, there is no way to extract any useful information. This should exactly explain which parameters can interact.",https://github.com/bitcoin/bitcoin/pull/17305#discussion_r340390850,340390850,doc/reduce-traffic.md
