ynvtlmr,2014-09-26T04:24:47Z,"Potentially stupid question to the thread regarding this patch:\n\nWas fooling around with no-fee dust-transactions, and had created one that was too insignificant by the standards discussed in the thread.\nAs a result, a bunch of coins are now stuck unconfirmed in limbo.\n\nQuestion is:\nAssuming someone pushes a no-fee dust-transaction, does it ever get verified?\nIf so, how long would it take?\",https://github.com/bitcoin/bitcoin/pull/2577#issuecomment-56918001,56918001,
laanwj,2014-09-26T07:43:07Z,"@ynvtimr You can just forget sending it, and regard the coins as not stuck. Most nodes will not even have let that transaction into the mempool, so will not regard another use of them as a double spend.\n",https://github.com/bitcoin/bitcoin/pull/2577#issuecomment-56929585,56929585,
ynvtlmr,2014-09-29T17:22:34Z,Makes sense.\nI figured that was likely the case as the transaction maintained 0% network propagation 4 days after the transaction date.\n,https://github.com/bitcoin/bitcoin/pull/2577#issuecomment-57195926,57195926,
ABISprotocol,2014-09-30T07:45:46Z,"'Uneconomic dust' was indicated in this pull as ""5430 satoshis, about $0.007.."" at the time this was opened in April 2013 (note however that per @sipa ~ the meaning of 'uneconomic dust' is actually ""3 times the cost (according to your own node's relay rules, which are configurable) of the number of bytes that are added to the blockchain by the relevant output plus how many are needed to spend it,""",https://github.com/bitcoin/bitcoin/pull/2577#issuecomment-57278278,57278278,
sipa,2014-09-30T16:17:36Z,"Uneconomic dust is not defined as a specific number of satoshis.\n\nIt is 3 times the cost (according to your own node's relay rules, which are\nconfigurable) of the number of bytes that are added to the blockchain by\nthe relevant output plus how many are needed to spend it.\n\nIn future versions the relay rules may be estimated from transactions in\nthe network, rather than being an (overridable",https://github.com/bitcoin/bitcoin/pull/2577#issuecomment-57339880,57339880,
ABISprotocol,2014-10-02T01:27:49Z,"@sipa Making correction to my prior comment, thanks for your clarification.\n",https://github.com/bitcoin/bitcoin/pull/2577#issuecomment-57567847,57567847,
MeTheAK,2019-01-29T16:19:42Z,Is this protocol still in use? like no one can send less than 5430,https://github.com/bitcoin/bitcoin/pull/2577#issuecomment-458603883,458603883,
Diapolo,2013-04-26T16:03:13Z,"Gavin, if you want this to be an error please use CClientUIInterface::MSG_ERROR or CClientUIInterface::MSG_WARNING for a warning :).\n",https://github.com/bitcoin/bitcoin/pull/2577#discussion_r3979511,3979511,src/qt/walletmodel.cpp
Diapolo,2013-04-26T16:04:43Z,"These 2 switches are not mentioned in our init.cpp help-message, is this intended?\n",https://github.com/bitcoin/bitcoin/pull/2577#discussion_r3979549,3979549,src/init.cpp
gmaxwell,2013-04-26T16:10:55Z,> (which I'm intentionally leaving undocumented for now)\n\nYes. \n,https://github.com/bitcoin/bitcoin/pull/2577#discussion_r3979674,3979674,src/init.cpp
Diapolo,2013-04-27T15:41:58Z,"@gavinandresen CClientUIInterface::MSG_ERROR includes CClientUIInterface::MODAL, that's why I mentioned it the first time :).\n",https://github.com/bitcoin/bitcoin/pull/2577#discussion_r3989392,3989392,src/qt/walletmodel.cpp
