gmaxwell,2013-02-12T00:19:13Z,"Suggested additional test:  Click multiple links in rapid succession, does it break, can the user accidentally confirm the wrong payment?\n",https://github.com/bitcoin/bitcoin/pull/2299#issuecomment-13411697,13411697,
laanwj,2013-02-12T06:59:48Z,"This needs some testing, but it is absolutely the right way forward. \n",https://github.com/bitcoin/bitcoin/pull/2299#issuecomment-13420555,13420555,
gavinandresen,2013-02-12T14:25:59Z,"I'll make the server its own class. And I'll use QString::number (I missed that method reading the QString docs).\n\nI should have this working on the Mac, too soon.\n",https://github.com/bitcoin/bitcoin/pull/2299#issuecomment-13434492,13434492,
BitcoinPullTester,2013-02-12T21:24:21Z,"Automatic sanity-testing: PASSED, see http://jenkins.bluematt.me/pull-tester/8269a0953ee9ccbdc422433fc37184e60f94b178 for binaries and test log.\n",https://github.com/bitcoin/bitcoin/pull/2299#issuecomment-13459679,13459679,
gavinandresen,2013-02-14T00:04:50Z,Updated / rebased.  I'm happy with this code now.\n,https://github.com/bitcoin/bitcoin/pull/2299#issuecomment-13526169,13526169,
laanwj,2013-02-24T07:47:22Z,ACK\n,https://github.com/bitcoin/bitcoin/pull/2299#issuecomment-14005003,14005003,
laanwj,2013-02-12T06:01:09Z,"ACK on the code changes. My only comment is that this server code shouldn't be in bitcoingui.cpp, I think it would be better to create a new class for it in qtipcserver.cpp which is neigh-empty now.\n",https://github.com/bitcoin/bitcoin/pull/2299#discussion_r2974064,2974064,src/qt/bitcoingui.cpp
Diapolo,2013-02-12T06:39:05Z,"ACK on wrong place, perhaps we should remove qtipcserver.cpp and creatre a new qturihandler.cpp (or sth. like that)?\n",https://github.com/bitcoin/bitcoin/pull/2299#discussion_r2974245,2974245,src/qt/bitcoingui.cpp
Diapolo,2013-02-12T07:03:27Z,"If we are talking about the Qt way ^^, why not do:\n\n<pre>\n    QString name(""BitcoinQt"");\n    QString ddir(QString::fromStdString(GetDataDir(true).string()));\n    name.append(QString::number(qHash(ddir)));\n</pre>\n",https://github.com/bitcoin/bitcoin/pull/2299#discussion_r2974334,2974334,src/qt/qtipcserver.cpp
