laanwj,2015-05-24T09:04:02Z,utACK\n,https://github.com/bitcoin/bitcoin/pull/6172#issuecomment-104995583,104995583,
morcos,2015-05-24T21:06:01Z,Tested ACK\n,https://github.com/bitcoin/bitcoin/pull/6172#issuecomment-105062074,105062074,
sdaftuar,2015-05-27T16:21:06Z,Fixed nit\n,https://github.com/bitcoin/bitcoin/pull/6172#issuecomment-105983568,105983568,
laanwj,2015-06-01T16:33:27Z,Needs to be backported to 0.11 at least\n,https://github.com/bitcoin/bitcoin/pull/6172#issuecomment-107628630,107628630,
rebroad,2015-06-08T20:13:53Z,Shouldn't we still send headers for the blocks we have?\n,https://github.com/bitcoin/bitcoin/pull/6172#issuecomment-110123889,110123889,
sdaftuar,2015-06-10T13:31:53Z,"@rebroad Please see related comment here: https://github.com/bitcoin/bitcoin/pull/5927#issuecomment-104665085.  Before IBD has finished, it's possible to be on a chain that would violate a checkpoint, and responding to a getheaders request at that point could then cause an honest peer to disconnect.\n",https://github.com/bitcoin/bitcoin/pull/6172#issuecomment-110752459,110752459,
rebroad,2016-11-04T05:14:28Z,https://botbot.me/freenode/bitcoin-core-dev/msg/75840350/ @gmaxwell your comment recently is MORE applicable here...\n,https://github.com/bitcoin/bitcoin/pull/6172#issuecomment-258346696,258346696,
Diapolo,2015-05-24T17:43:10Z,I hope we soon and finally apply the clang-format ;).\n,https://github.com/bitcoin/bitcoin/pull/6172#discussion_r30954208,30954208,src/main.cpp
laanwj,2015-05-27T08:04:29Z,"Yes, it's completely inconsequential, but pedantically the `return true` should be on the next line and indented.\n",https://github.com/bitcoin/bitcoin/pull/6172#discussion_r31111014,31111014,src/main.cpp
