jgarzik,2014-08-28T21:35:49Z,"1) This is only a partial fix for #4669 because as noted _everything_ is flushed in the case where the lockfile is present.  This solves one symptom of the larger problem.\n2) whitespace after ""if\n",https://github.com/bitcoin/bitcoin/pull/4784#issuecomment-53804562,53804562,
jgarzik,2014-08-28T21:37:47Z,"3) Your solution is generally OK\n\n4) addrman.size() will never be negative\n\n5) Hey, that would make a great addrman cleanup, wouldn't it?  :)\n",https://github.com/bitcoin/bitcoin/pull/4784#issuecomment-53804781,53804781,
Diapolo,2014-08-28T21:47:34Z,"@jgarzik \n1./3. Yeah, I intended to not fix the larger problem with the lockfile, but the specific one mentioned.\n2. Will update, thanks for catching it :).\n4. But we return an int for the size so isn't it better to leave it that way?\n5. Do you want me to make size an unsigned integer or change the commit-msg ^^, don't understand.\n",https://github.com/bitcoin/bitcoin/pull/4784#issuecomment-53805873,53805873,
jgarzik,2014-08-28T22:46:41Z,"@Diapolo addrman's size() should return 'unsigned int' (technically size_type, what std::vector<>::size() returns)  And in doing so, that makes testing addrman.size() less-than-zero incorrect, enabling removal of that case (becomes not-zero test).\n",https://github.com/bitcoin/bitcoin/pull/4784#issuecomment-53815705,53815705,
Diapolo,2014-08-29T09:51:43Z,@jgarzik Can you re-check this pull?\n,https://github.com/bitcoin/bitcoin/pull/4784#issuecomment-53857158,53857158,
BitcoinPullTester,2014-08-29T10:05:42Z,"Automatic sanity-testing: PASSED, see http://jenkins.bluematt.me/pull-tester/p4784_4985aaa43a5a4762db3f16037c2da43aad3ff21f/ for binaries and test log.\nThis test script verifies pulls every time they are updated. It, however, dies sometimes and fails to test properly.  If you are waiting on a test, please check timestamps to verify that the test.log is moving at http://jenkins.bluematt.me/pull-te",https://github.com/bitcoin/bitcoin/pull/4784#issuecomment-53858414,53858414,
laanwj,2014-09-18T12:23:37Z,Closing in favor of #4942.\n,https://github.com/bitcoin/bitcoin/pull/4784#issuecomment-56030666,56030666,
laanwj,2014-08-30T03:28:04Z,"Now you use `addrman.size()==0` implicitly to determine whether to write the list at exit. It works, but could lead to strange corner case if we actually need to write an empty list for some reason in the future.\n\nIt would lead to more understandable code to explicitly keep track of whether we reached the stage of initialization where addrman was initialized.\n\nA more general solution would be ",https://github.com/bitcoin/bitcoin/pull/4784#discussion_r16927646,16927646,src/net.cpp
Diapolo,2014-09-18T12:33:30Z,"@laanwj I think DumpAddresses could carry a flag bool fForce for example, to force re-creation of that file instead.\n",https://github.com/bitcoin/bitcoin/pull/4784#discussion_r17723680,17723680,src/net.cpp
