laanwj,2016-01-13T21:14:23Z,"Thanks, ACK\n",https://github.com/bitcoin/bitcoin/pull/7336#issuecomment-171434623,171434623,
MarcoFalke,2016-01-13T21:27:57Z,"Great, thanks for taking a look!\n\nACK 82667af\n",https://github.com/bitcoin/bitcoin/pull/7336#issuecomment-171440042,171440042,
MarcoFalke,2016-01-13T21:28:41Z,> maybe it should go in the detailed changes section though\n\nRight. Could you add another commit to do this?\n,https://github.com/bitcoin/bitcoin/pull/7336#issuecomment-171440232,171440232,
laanwj,2016-01-13T21:38:07Z,"Re: abandontransaction it is already mentioned in the detailed changes:\n\n> - #7312 `fd4bd50` Add RPC call abandontransaction\n\nAs I understood it's meant as a mostly hidden feature, to be used if there is another mempool flood / malleation attack, so I think that is mention enough.\n",https://github.com/bitcoin/bitcoin/pull/7336#issuecomment-171442588,171442588,
morcos,2016-01-13T21:43:31Z,"Oh sorry, I was looking for it in wallet\nNo I agree, I think its ok not to draw explicit attention to it\n",https://github.com/bitcoin/bitcoin/pull/7336#issuecomment-171444834,171444834,
MarcoFalke,2016-01-14T10:31:05Z,Missed it as well. 82667af looks ready to merge.\n,https://github.com/bitcoin/bitcoin/pull/7336#issuecomment-171600606,171600606,
jonasschnelli,2016-01-14T19:27:15Z,ACK\n,https://github.com/bitcoin/bitcoin/pull/7336#issuecomment-171751835,171751835,
