maqifrnswa,2013-02-26T15:10:48Z,"Debian is at least looking at including memenv, won't happen until after Wheezy is released though:\nhttp://bugs.debian.org/cgi-bin/bugreport.cgi?bug=701075\n",https://github.com/bitcoin/bitcoin/pull/2241#issuecomment-14119293,14119293,
luke-jr,2013-02-26T15:49:22Z,@maqifrnswa memenv is only needed for test_bitcoin.\n,https://github.com/bitcoin/bitcoin/pull/2241#issuecomment-14121602,14121602,
jgarzik,2013-06-19T18:56:10Z,"ACK\n\nThough this will certainly need updating, pending autotools work\n",https://github.com/bitcoin/bitcoin/pull/2241#issuecomment-19705816,19705816,
sipa,2013-06-19T19:20:48Z,"I'd delay this until after autotoolification, as it would need to be redone from scratch otherwise anyway.\n\nHowever, all but test_bitcoin not linking against libmemenv.a seems meaningful by itself.\n",https://github.com/bitcoin/bitcoin/pull/2241#issuecomment-19707658,19707658,
luke-jr,2013-07-16T22:59:50Z,"In the meantime, I fixed a bug building test_bitcoin against system leveldb (memenv.h is not in a subdirectory)\n",https://github.com/bitcoin/bitcoin/pull/2241#issuecomment-21080560,21080560,
BitcoinPullTester,2013-07-21T07:52:52Z,"Automatic sanity-testing: FAILED BUILD/TEST, see http://jenkins.bluematt.me/pull-tester/9f62e7c190d27b14b834d6d085ad136c496e83d0 for binaries and test log.\n\nThis could happen for one of several reasons:\n1. It chanages paths in makefile.linux-mingw or otherwise changes build scripts in a way that made them incompatible with the automated testing scripts (please tweak those patches in contrib/tes",https://github.com/bitcoin/bitcoin/pull/2241#issuecomment-21306528,21306528,
Diapolo,2013-10-10T12:48:32Z,"This needs rebase because of Autotools, dunno if it's even required...\n",https://github.com/bitcoin/bitcoin/pull/2241#issuecomment-26050354,26050354,
laanwj,2013-10-16T09:17:02Z,Closing this as autotools will need a completely different solution.\n,https://github.com/bitcoin/bitcoin/pull/2241#issuecomment-26403300,26403300,
