luke-jr,2012-01-18T20:00:27Z,"It's not useless, and not worse. Stop trolling.\n\n[14:59:12] <luke-jr> BlueMatt: I'm not going to waste time arguing over something stupid like this. It's better now than it was before. If you want to improve on it, go ahead. If not, that's no excuse to complain it's imperfect and rip it out.\n",https://github.com/bitcoin/bitcoin/pull/766#issuecomment-3552172,3552172,
TheBlueMatt,2012-01-18T20:01:58Z,"My point is that its worthless info, mucks up the code that much more, and should never have been merged.  Since its not actually released, there is no harm in removing it.\n",https://github.com/bitcoin/bitcoin/pull/766#issuecomment-3552194,3552194,
TheBlueMatt,2012-01-18T20:19:28Z,Readded nPooledTx and nLastBlockTx in a reasonable way.\n,https://github.com/bitcoin/bitcoin/pull/766#issuecomment-3552424,3552424,
luke-jr,2012-01-18T20:20:42Z,currentblocksize is missing\n,https://github.com/bitcoin/bitcoin/pull/766#issuecomment-3552438,3552438,
TheBlueMatt,2012-01-18T20:37:11Z,"I'm not gonna fix all your code for you, I was just showing that your claims that it's impossible to do well without a ton of changes were unfounded.\n\nLuke-Jr reply@reply.github.com wrote:\n\ncurrentblocksize is missing\n\n---\n\nReply to this email directly or view it on GitHub:\nhttps://github.com/bitcoin/bitcoin/pull/766#issuecomment-3552438\n",https://github.com/bitcoin/bitcoin/pull/766#issuecomment-3552681,3552681,
TheBlueMatt,2012-02-18T07:32:45Z,Superseded by 4b54cb93e87816c50e5da90767ee1bc056166552 in cblockstore.\n,https://github.com/bitcoin/bitcoin/pull/766#issuecomment-4032545,4032545,
