kallewoof,2017-02-26T01:32:24Z,"I'm unsure why the filename is needed, esp since it is printed in both outcomes later. If it is needed, you would need filename for banlist.dat load as well (line 2228), no?",https://github.com/bitcoin/bitcoin/pull/9861#issuecomment-282525566,282525566,
keystrike,2017-02-26T01:51:14Z,"The filename isn't as important as stating that p2p addresses are being loaded rather than wallet addresses. I added the filename just to be sure it was clear. This line happens shortly after ""mapAddressBook.size() = 1"" in debug.log, so it isn't obvious what these addresses are -- especially confusing when -disablewallet is set.\n\nIt may help if I explain why I noticed this. Previous versions o",https://github.com/bitcoin/bitcoin/pull/9861#issuecomment-282526292,282526292,
MarcoFalke,2017-02-27T12:58:17Z,"After fixing the nit, please squash your commits according to https://github.com/bitcoin/bitcoin/blob/master/CONTRIBUTING.md#squashing-commits",https://github.com/bitcoin/bitcoin/pull/9861#issuecomment-282712315,282712315,
keystrike,2017-02-27T19:13:17Z,"I'm sorry, I made a mistake when trying to squash my commits. Would someone please help?",https://github.com/bitcoin/bitcoin/pull/9861#issuecomment-282819317,282819317,
laanwj,2017-02-28T11:24:48Z,"@keystrike: the git 'reflog' has a backup of all your past HEADs, so nothing will be lost, you can restore your old state if you can find it (with `reset --hard <commitid>`) and re-do from there.\n\nHaving said that, for small changes the easiest solution is sometimes to start over and just re-do your change and copy the commit message.",https://github.com/bitcoin/bitcoin/pull/9861#issuecomment-283014380,283014380,
MarcoFalke,2017-02-26T12:06:18Z,No need to mention the file name in a translated message. Also missing curly braces {} according to style guide.,https://github.com/bitcoin/bitcoin/pull/9861#discussion_r103102803,103102803,src/net.cpp
laanwj,2017-02-27T09:39:26Z,s/p2p/P2P,https://github.com/bitcoin/bitcoin/pull/9861#discussion_r103166574,103166574,src/net.cpp
