luke-jr,2015-06-22T23:49:32Z,"More efficient how? If anything, this would be _less_ efficient. \n",https://github.com/bitcoin/bitcoin/pull/6323#issuecomment-114306251,114306251,
penguin1333,2015-06-23T01:32:31Z,"@luke-jr\n\nThis isn't less efficient. We're never going to change it, so why keep it hard coded? It's bad practice.\n\nBut either way, it works the same. So I'd just say to merge it if you want more ""pretty"" code.\n",https://github.com/bitcoin/bitcoin/pull/6323#issuecomment-114319687,114319687,
penguin1333,2015-06-23T01:35:34Z,"Here's an example:\n\nYou have 1 apple.\n\nYou want to count it 3 times.\n\nYou could say ""1 apple + 1 apple + 1 apple""\n\nor you could store it in say, a variable called ""a"" and do ""a*3""\n",https://github.com/bitcoin/bitcoin/pull/6323#issuecomment-114321340,114321340,
paveljanik,2015-06-23T05:38:26Z,"NACK\nIf you want to have prettier code, why not rewrite the whole last phase of the function? Why skip zeroes and prefill with 1s at all?\n",https://github.com/bitcoin/bitcoin/pull/6323#issuecomment-114364347,114364347,
penguin1333,2015-06-23T06:01:18Z,"I guess that's true, but it wouldn't hurt to merge would it? It's been requested and it makes things neater imo. \n\nBut of course, that's arguable. I don't feel like arguing because it's a waste of time and I already probably agree with you. I just thought ""why not?"". Haha\n",https://github.com/bitcoin/bitcoin/pull/6323#issuecomment-114371721,114371721,
laanwj,2015-06-23T06:45:54Z,"I have no opinion on whether this is better or not. Something can be said for both sides.\n\nBut I feel this discussion is a waste of time, please don't make changes if they don't solve a problem, we're barged with pull requests as it is.\n",https://github.com/bitcoin/bitcoin/pull/6323#issuecomment-114379190,114379190,
