laanwj,2016-02-29T08:48:34Z,I think the idea behind `abandontransaction` as introduced in 0.12 (#7312) was to provide this functionality in a safer way. Deleting anything permanently from the db shouldn't be done lightly.\nPing @morcos \n,https://github.com/bitcoin/bitcoin/pull/7602#issuecomment-190106970,190106970,
instagibbs,2016-02-29T21:58:35Z,"While similar, this functionality is more meant to pair with #7558, which isn't applicable to abandontransaction. If you have a transaction in your wallet that is confirmed, yet you do not want to ""account for"" as having the funds, there isn't a way to do this. Primarily I think this could happen for instance with an erroneous application of #7558 .\n",https://github.com/bitcoin/bitcoin/pull/7602#issuecomment-190416084,190416084,
laanwj,2016-03-02T13:07:49Z,"I understand the application is different, but there's a risk in having vaguely similar functionality in different RPC calls.\nBefore adding abandontransaction we had a long discussion about what would be safe as well versus unsafe RPC call behavior for this purpose, so it already is a compromise.\n\nIdea: If it is meant as antidote to #7558, why not call it `removeprunedfunds` and make it only wo",https://github.com/bitcoin/bitcoin/pull/7602#issuecomment-191232218,191232218,
instagibbs,2016-03-02T14:56:20Z,"Understood and agreed. I might want to merge the two PRs then, and tag transactions in such a way to ensure that property.\n",https://github.com/bitcoin/bitcoin/pull/7602#issuecomment-191271594,191271594,
morcos,2016-03-02T17:52:25Z,I don't have a strong opinion about this functionality.\nI do think it is quite different from abandontransaction though\n,https://github.com/bitcoin/bitcoin/pull/7602#issuecomment-191348706,191348706,
laanwj,2016-03-03T13:18:04Z,"Well if really they're sufficiently different hat people won't get confused, I'm ok with adding this... But based on the names at least I would get confused as API user, I think. But that may be a documentation issue.\n",https://github.com/bitcoin/bitcoin/pull/7602#issuecomment-191757443,191757443,
instagibbs,2016-03-07T13:48:26Z,"Closing in favor of merging the two PRs, with more aligned names and description. \n",https://github.com/bitcoin/bitcoin/pull/7602#issuecomment-193253801,193253801,
