jonasschnelli,2015-05-26T20:26:10Z,LGTM. ACK.\nDidn't check the spelling / english.\n,https://github.com/bitcoin/bitcoin/pull/6189#issuecomment-105655236,105655236,
PRabahy,2015-05-27T00:27:58Z,Would it be worth it to include anything about switching wallets with pruning enabled? It is my understanding that if the blockfiles get pruned past where the wallet last updated that you will need to redownload the entire blockchain.\n,https://github.com/bitcoin/bitcoin/pull/6189#issuecomment-105703419,105703419,
sipa,2015-05-27T00:51:07Z,"If you run with pruning enabled, you cannot have any wallet at all,\ncurrently.\n",https://github.com/bitcoin/bitcoin/pull/6189#issuecomment-105705813,105705813,
PRabahy,2015-05-27T01:04:14Z,My bad. I thought #6057 had been merged.\n,https://github.com/bitcoin/bitcoin/pull/6189#issuecomment-105707258,105707258,
laanwj,2015-05-27T08:11:56Z,"@PRabahy That's a common misconception, so it is good that it's even mentioned in this text that pruning currently doesn't interoperate with the wallet.\n\n#6057 needs a lot of testing, but no matter what, it's too late for 0.11.\n",https://github.com/bitcoin/bitcoin/pull/6189#issuecomment-105812417,105812417,
laanwj,2015-05-27T09:36:07Z,ACK\n,https://github.com/bitcoin/bitcoin/pull/6189#issuecomment-105839570,105839570,
fanquake,2015-05-27T09:46:07Z,"ACK\n\nOn Wednesday, May 27, 2015, Wladimir J. van der Laan <\nnotifications@github.com> wrote:\n\n> ACK\n> \n> —\n> Reply to this email directly or view it on GitHub\n> https://github.com/bitcoin/bitcoin/pull/6189#issuecomment-105839570.\n",https://github.com/bitcoin/bitcoin/pull/6189#issuecomment-105842239,105842239,
jonasschnelli,2015-05-26T20:20:19Z,Would it be a overkill to mention that the REST block call (`/rest/block/<blockhash>.<json|bin|hex>`) also could return a http 404 if a pruned block was requested?\n(https://github.com/bitcoin/bitcoin/blob/e9af4e65b5afaa870f6cdcf2f7c2ee56c703bffa/src/rest.cpp#L200) \n,https://github.com/bitcoin/bitcoin/pull/6189#discussion_r31075250,31075250,doc/release-notes.md
