sipa,2016-05-01T09:52:34Z,have you seen #7964?\n,https://github.com/bitcoin/bitcoin/pull/7983#issuecomment-216031888,216031888,
domob1812,2016-05-01T09:59:15Z,"Ah, this contains parts of my patch, but not the `WorkQueue` change.  I suggest to rebase this once #7964 is merged.\n",https://github.com/bitcoin/bitcoin/pull/7983#issuecomment-216032124,216032124,
sipa,2016-05-01T10:01:34Z,Perhaps also see #7966.\n,https://github.com/bitcoin/bitcoin/pull/7983#issuecomment-216032218,216032218,
MarcoFalke,2016-05-01T10:23:03Z,"diff between the existing pulls and this one:\n\n``` diff\ndiff --git a/src/chain.h b/src/chain.h\nindex 017d4fe..5b9605a 100644\n--- a/src/chain.h\n+++ b/src/chain.h\n@@ -54,7 +54,7 @@ struct CDiskBlockPos\n\n };\n\n-enum BlockStatus: uint32_t {\n+enum BlockStatus {\n     //! Unused.\n     BLOCK_VALID_UNKNOWN      =    0,\n\ndiff --git a/src/httpserver.cpp b/src/httpserver.cpp\nindex 55c81c1..64a",https://github.com/bitcoin/bitcoin/pull/7983#issuecomment-216033036,216033036,
domob1812,2016-05-01T10:30:22Z,"Well, ok, I guess then nothing remains of this patch and the PR can be closed....\n",https://github.com/bitcoin/bitcoin/pull/7983#issuecomment-216033375,216033375,
laanwj,2016-05-02T11:11:18Z,"Right, the overlap with other pulls is too large, closing.\n",https://github.com/bitcoin/bitcoin/pull/7983#issuecomment-216205421,216205421,
