sipa,2016-09-28T02:38:55Z,utACK 0a1229617d647d8d288f2afa3006d6a6a5d942a1. This inconsistency has bothered me before.\n,https://github.com/bitcoin/bitcoin/pull/8822#issuecomment-250056879,250056879,
laanwj,2016-09-28T10:44:38Z,"I've slightly changed the error message to no longer mention nChecksum, as the name of the field changed and is not relevant for troubleshooting anyway:\n\n```\n2016-09-28 10:42:19.666628 ProcessMessages(ping, 8 bytes): CHECKSUM ERROR expected 7ef0ca62 was 12234556\n```\n\nIn some later pull we'd likely want to move all these messages to the net debug category. I'm also going to add a test later t",https://github.com/bitcoin/bitcoin/pull/8822#issuecomment-250133264,250133264,
jonasschnelli,2016-09-28T13:12:37Z,utACK 41e58faf043864a64a6db08a8df527fa5fd1ec5b\nAny reason to keep `CHECKSUM_SIZE = sizeof(int)` (`protocol.h`) instead of just `CHECKSUM_SIZE = 4`?\n,https://github.com/bitcoin/bitcoin/pull/8822#issuecomment-250162230,250162230,
laanwj,2016-09-28T13:32:04Z,"> Any reason to keep `CHECKSUM_SIZE = sizeof(int)` (`protocol.h`) instead of just `CHECKSUM_SIZE = 4`?\n\nYes, I thought about that too, we **know** that the checksum is always four bytes and it shouldn't change based on what happens to be the architectures int type. WIll do.\n\nEdit: Done. Also changed the SIZE_SIZE to be a fixed-size uint32_t the same go. We already use `WriteLE32` at the packet",https://github.com/bitcoin/bitcoin/pull/8822#issuecomment-250167211,250167211,
jonasschnelli,2016-09-28T13:13:52Z,A size check of `hash.size() <=  CMessageHeader::CHECKSUM_SIZE` is probably a total overkill...\n,https://github.com/bitcoin/bitcoin/pull/8822#discussion_r80911485,80911485,src/main.cpp
laanwj,2016-09-28T13:38:11Z,A compile-time assertion could be added... But I don't think there is any risk of someone increasing `CHECKSUM_SIZE` larger than 32 in practice.\n,https://github.com/bitcoin/bitcoin/pull/8822#discussion_r80916992,80916992,src/main.cpp
rebroad,2016-10-09T08:48:51Z,"are these the wrong way around? i.e. the expected checksum is supposed to be displayed before the ""was""?\n",https://github.com/bitcoin/bitcoin/pull/8822#discussion_r82518003,82518003,src/main.cpp
