jtimon,2015-04-08T15:26:48Z,Note that AcceptToMemoryPool is ignored because the calls to Params() there will be replaced with policy initialization in init.cpp.\n,https://github.com/bitcoin/bitcoin/pull/5970#issuecomment-90950299,90950299,
jtimon,2015-04-23T13:00:27Z,"Closing for now, although I will keep updating the dependencies and rebasing.\n",https://github.com/bitcoin/bitcoin/pull/5970#issuecomment-95576948,95576948,
jtimon,2015-08-27T06:30:44Z,"Rebased and reopened. #6024 replaced with #6591.\nvoluntaries required for the step ""Chainparams: Explicit CChainParams in net.o"" which is not coded here.\nHopefully someone heavily touching net.o for any other reason (please tell anyone you know doing that about this PR) doesn't mind to take that part.\nThe final step ""Chainparams: Remove SelectParams()"" is not coded either, but I'm more than hap",https://github.com/bitcoin/bitcoin/pull/5970#issuecomment-135308217,135308217,
dcousens,2015-08-27T07:46:33Z,Comparison URL to review this PR independently of its dependent: https://github.com/jtimon/bitcoin/compare/consensus-params-0.12.99...jtimon:chainparams_cleanup\n,https://github.com/bitcoin/bitcoin/pull/5970#issuecomment-135324503,135324503,
jtimon,2015-09-03T00:14:09Z,Rebased on top of #6591 \n,https://github.com/bitcoin/bitcoin/pull/5970#issuecomment-137278512,137278512,
jtimon,2015-11-11T12:31:54Z,"Rebased after #6163 and #6982 have been merged, opened #6986.\n",https://github.com/bitcoin/bitcoin/pull/5970#issuecomment-155764966,155764966,
jtimon,2015-11-18T11:52:45Z,"Replaced by #7053. Since I think it was extremely\nuseful to group many related PRs under one big ""DEPENDENT"" one and coordinate how many of them are opened at the same time; at some\npoint after 0.12 is forked I will open and analogous PR to continue\nthis one. But even if I believe that `Params()` is a great example of an\napparently-hard-to-remove global, the next PR will be more generic: there",https://github.com/bitcoin/bitcoin/pull/5970#issuecomment-157688788,157688788,
