gmaxwell,2012-05-14T18:49:59Z,"(Just for the benefit of people finding this pull request in google searches:  Negative timestamps are not a sign of manipulation, nodes make no effort to avoid negative timestamps— they just use their accurate times.  Ntimerolling by miners sometimes moves the time far ahead and then the next block gets the correct time at a time earlier than the prior one)\n",https://github.com/bitcoin/bitcoin/pull/1304#issuecomment-5698631,5698631,
rebroad,2012-05-14T18:56:02Z,"@gmaxwell they aren't usually a sign of manipulation, but they _could_ be a sign. This is correct, right? It's rare, admittedly, and might never have happened so far!\n",https://github.com/bitcoin/bitcoin/pull/1304#issuecomment-5698826,5698826,
gmaxwell,2012-05-14T18:59:44Z,"@rebroad It's not an interesting form of manipulation (someone could lie to slightly increase the difficulty by a about half a percent), but I wasn't taking issue with your comment.  There have been some people who saw the negative going timestamps and ran around claiming it was an attack, seems to be a common mistake people make in assuming that it won't happen absent an attack.  Logging it sound",https://github.com/bitcoin/bitcoin/pull/1304#issuecomment-5698948,5698948,
sipa,2012-06-12T19:39:42Z,"ACK. I think it's still interesting to have these in debug.log, even if just as a way of keeping track of how far you are behind.\n",https://github.com/bitcoin/bitcoin/pull/1304#issuecomment-6280388,6280388,
Diapolo,2012-06-12T20:57:54Z,"If you indent, can you please ""always"" use 4 spaces (4 spaces == 1 tab kind of)?\n",https://github.com/bitcoin/bitcoin/pull/1304#issuecomment-6282647,6282647,
rebroad,2012-06-14T16:31:28Z,"@Diapolo I thought 4 spaces was for inside functions/parenthesis, and 2 spaces is for lines that have been broken up over more than one line.\n",https://github.com/bitcoin/bitcoin/pull/1304#issuecomment-6333610,6333610,
Diapolo,2012-06-14T16:35:46Z,"I'm not sure abot that, it just looked weird to me.\n",https://github.com/bitcoin/bitcoin/pull/1304#issuecomment-6333735,6333735,
rebroad,2012-09-01T14:44:14Z,oooh.. it got merged. almost 3 months later. cool. thanks!\n,https://github.com/bitcoin/bitcoin/pull/1304#issuecomment-8213502,8213502,
