morcos,2015-10-10T21:50:13Z,"There are a few things I don't like about this implementation, such as starting the feeCutoff at 0 (instead of 1000 sat/kb).  But I do think an approach like this would work to ""solve"" this problem in 0.10 and 0.11 backports.  The problem with #6673 is there was no limit to how high the fee went, but if its capped at some value that is still potentially reasonable for a min relay fee (like in this",https://github.com/bitcoin/bitcoin/pull/6803#issuecomment-147128577,147128577,
ptschip,2015-10-10T22:25:37Z,"Starting the feeCutoff at 0 is easily changed, (we can start it anywhere\n) but it does rise quite quickly once the mempool is full.  When you\ncompile and run use debug=mempool and the log entries show you how the\nvalues change as the mempool increases or decreases.\n\nOn 10/10/2015 2:50 PM, Alex Morcos wrote:\n\n> There are a few things I don't like about this implementation, such as\n> startin",https://github.com/bitcoin/bitcoin/pull/6803#issuecomment-147130545,147130545,
TheBlueMatt,2015-10-14T10:03:49Z,I really prefer #6722 over this. It seems gratuitous to have a less-effecient implementation for mempool limiting unless we decide #6722 is overcomplicated or otherwise not mergedable.\n,https://github.com/bitcoin/bitcoin/pull/6803#issuecomment-147998424,147998424,
morcos,2015-10-14T11:55:59Z,"Oh I meant in consideration for a backport not for master. \n\nSent from my iPhone\n\n> On Oct 14, 2015, at 6:04 AM, Matt Corallo notifications@github.com wrote:\n> \n> I really prefer #6722 over this. It seems gratuitous to have a less-effecient implementation for mempool limiting unless we decide #6722 is overcomplicated or otherwise not mergedable.\n> \n> —\n> Reply to this email directly or vi",https://github.com/bitcoin/bitcoin/pull/6803#issuecomment-148027377,148027377,
ptschip,2015-10-15T10:29:48Z,"Here's a plot of the last 12 hours showing the actual mempool size and cumulative blocked (spam) transactions over time (x axis in minutes, y axis in MiB).  \n\n![mempool](https://cloud.githubusercontent.com/assets/12862928/10511149/2581a8f6-72ec-11e5-9a71-1ed88323fd20.png)\n",https://github.com/bitcoin/bitcoin/pull/6803#issuecomment-148345653,148345653,
gmaxwell,2015-11-22T23:00:50Z,"Closing this because I think it's been eclipsed by the mempool limiting thats merged and the related fixes around it in the pipeline. If I've made an error, feel free to yell at me. :) \n",https://github.com/bitcoin/bitcoin/pull/6803#issuecomment-158816740,158816740,
