jgarzik,2014-02-21T19:20:58Z,"@super3 The Bitcoin Foundation does not officially or unofficially offer the torrent.  That's all me, in my spare time.\n",https://github.com/bitcoin/bitcoin/pull/3724#issuecomment-35763528,35763528,
luke-jr,2014-02-21T19:27:45Z,@jgarzik Where does the Bitcoin Foundation come into this PR at all? I don't see @super3 suggesting they endorse anything...\n,https://github.com/bitcoin/bitcoin/pull/3724#issuecomment-35764231,35764231,
super3,2014-02-21T19:32:10Z,"Whoops, didn't read my writers work well enough. \n\n@luke-jr There is an incorrect assertion in the actually tutorial.\n@jgarzik Sorry about that. Fixing it now. \n",https://github.com/bitcoin/bitcoin/pull/3724#issuecomment-35764671,35764671,
super3,2014-02-21T19:36:26Z,"Ok, that has been fixed. Let me know if there is anything else. \n",https://github.com/bitcoin/bitcoin/pull/3724#issuecomment-35765125,35765125,
BitcoinPullTester,2014-02-21T19:44:40Z,"Automatic sanity-testing: PASSED, see http://jenkins.bluematt.me/pull-tester/1b61d988987f9197ff2fb321c1dbf0a246ea349e for binaries and test log.\nThis test script verifies pulls every time they are updated. It, however, dies sometimes and fails to test properly.  If you are waiting on a test, please check timestamps to verify that the test.log is moving at http://jenkins.bluematt.me/pull-tester/cu",https://github.com/bitcoin/bitcoin/pull/3724#issuecomment-35765894,35765894,
super3,2014-02-25T14:21:32Z,"Ok, I can do that. \n",https://github.com/bitcoin/bitcoin/pull/3724#issuecomment-36011391,36011391,
laanwj,2014-02-25T07:33:37Z,It would be best to include this guide in the Bitcoin tree instead of referring to an external site. Not that this is worse than referring people to the bitcointalk forums.\n,https://github.com/bitcoin/bitcoin/pull/3724#discussion_r10026559,10026559,doc/README.md
