super3,2015-05-09T16:25:56Z,@laanwj @theuni Should be all fixed now.\n,https://github.com/bitcoin/bitcoin/pull/6045#issuecomment-100512160,100512160,
laanwj,2015-05-15T10:37:04Z,"Merged via 16e8ea3 (rebased, with some extra improvements)\n",https://github.com/bitcoin/bitcoin/pull/6045#issuecomment-102365240,102365240,
laanwj,2015-05-01T12:56:25Z,"btw this double make makes no sense, what as the intention here @theuni?\n",https://github.com/bitcoin/bitcoin/pull/6045#discussion_r29499892,29499892,depends/README_USAGE.md
theuni,2015-05-01T14:00:04Z,whoops. This is just busted c/p from an initial version of depends that worked differently (required make && make install). Wrong on several levels :)\n\nThe second part can just be dropped.\n,https://github.com/bitcoin/bitcoin/pull/6045#discussion_r29502658,29502658,depends/README_USAGE.md
super3,2015-05-02T05:11:57Z,So just change to:\n\n```\n To build for another arch/OS:\n      make HOST=host-platform-triplet\n```\n,https://github.com/bitcoin/bitcoin/pull/6045#discussion_r29545247,29545247,depends/README_USAGE.md
laanwj,2015-05-06T16:13:49Z,@super3: yes\n,https://github.com/bitcoin/bitcoin/pull/6045#discussion_r29774054,29774054,depends/README_USAGE.md
