jonasschnelli,2016-10-19T14:57:11Z,"Changing old release notes makes no sense IMO and stuff like this leads to ""pull-request-overview pollution"".\n",https://github.com/bitcoin/bitcoin/pull/8974#issuecomment-254838602,254838602,
MarcoFalke,2016-10-19T15:06:30Z,"Sometimes we change release notes when an issue is discovered shortly after release, but I don't think fixing _0.4.0_ release notes helps anyone.\n",https://github.com/bitcoin/bitcoin/pull/8974#issuecomment-254841460,254841460,
laanwj,2016-10-19T15:06:44Z,"Yes, 0.4.0 is ancient. Let's not mess with historical documents like this...\n\nThanks for trying to help, but it would be much more helpful to correct e.g. language in the the RPC help or build documents.\n",https://github.com/bitcoin/bitcoin/pull/8974#issuecomment-254841534,254841534,
MarcoFalke,2016-10-19T16:15:12Z,"@s-matthew-english If you are looking for small things to help out with, you can\n- search through the [easy to implement](https://github.com/bitcoin/bitcoin/issues?q=is%3Aissue+is%3Aopen+label%3A%22Easy+to+implement%22) issues.\n- write tests to improve the coverage (both unit tests and rpc tests are welcome)\n- help with review and testing (There are easy ones such as the [gui](https://github.co",https://github.com/bitcoin/bitcoin/pull/8974#issuecomment-254862599,254862599,
smatthewenglish,2016-10-19T16:49:44Z,"@jonasschnelli ah, please forgive me I wasn't trying to pollute the pull-request-overview. my idea was that, if I'm trying to understand some else's code I guess I would read through the release history and all the comments first. I won't submit pull-requests about old release notes anymore\n\n@laanwj @MarcoFalke thank you! for sure I'll check those out\n\ndo you guys know a good resource on C++ t",https://github.com/bitcoin/bitcoin/pull/8974#issuecomment-254872501,254872501,
smatthewenglish,2016-10-19T17:26:57Z,":/ I checked out the gui and rpc issues, I feel like I don't understand the code well enough yet to contribute in a good way there.\n\nmy idea was to bootstrap my knowledge of the code, and my ability to work with git by reading through the comments and initially just making some small improvements, do you think, if I avoided the old release notes, that it could be something useful? the last thing",https://github.com/bitcoin/bitcoin/pull/8974#issuecomment-254882822,254882822,
laanwj,2016-10-19T18:00:42Z,"@s-matthew-english \nAs you seem documentation-focused I'll give some examples related to that. I'd recommend focusing on user-facing things, not developer-facing things such as code comments (unless they're terribly wrong; a typo in a comment is meh). But anything user-facing is bound to have much more impact.\n\nFor example, RPC help messages. The RPC help messages are part of the code, but in p",https://github.com/bitcoin/bitcoin/pull/8974#issuecomment-254892141,254892141,
