BitcoinPullTester,2014-09-18T11:47:25Z,"Automatic sanity-testing: PASSED, see http://jenkins.bluematt.me/pull-tester/p4941_a49f11d9edf2f7dbce154ca370494a8f86e013d0/ for binaries and test log.\nThis test script verifies pulls every time they are updated. It, however, dies sometimes and fails to test properly.  If you are waiting on a test, please check timestamps to verify that the test.log is moving at http://jenkins.bluematt.me/pull-te",https://github.com/bitcoin/bitcoin/pull/4941#issuecomment-56027515,56027515,
cozz,2014-09-19T18:12:19Z,Works for me. (linux qt4 and qt5)\n,https://github.com/bitcoin/bitcoin/pull/4941#issuecomment-56213837,56213837,
theuni,2014-09-19T18:44:12Z,works as intended on osx.\n,https://github.com/bitcoin/bitcoin/pull/4941#issuecomment-56217961,56217961,
laanwj,2014-09-22T07:36:54Z,"Just after merging I realize that this makes it possible to _close_ (using the corner X) the splash screen. The same is possible for the window shown on shutdown. This is not harmful in itself, but does still create a way to close the window without a way to bring it back. Probably should be disallowed at some point.\n",https://github.com/bitcoin/bitcoin/pull/4941#issuecomment-56338352,56338352,
Diapolo,2014-09-22T12:29:43Z,@laanwj Is this left in by intention?\n,https://github.com/bitcoin/bitcoin/pull/4941#discussion_r17845535,17845535,src/qt/splashscreen.cpp
laanwj,2014-09-22T13:03:38Z,We paint the entire background so it should not be necessary\n,https://github.com/bitcoin/bitcoin/pull/4941#discussion_r17846795,17846795,src/qt/splashscreen.cpp
