paveljanik,2017-06-03T07:06:03Z,"If `""pull requests.""` is good grammar, the grammar is bad.\n\nNACK",https://github.com/bitcoin/bitcoin/pull/10513#issuecomment-305957074,305957074,
fanquake,2017-06-05T01:36:42Z,"Agree with @paveljanik, neither change seems to be fixing any grammar.",https://github.com/bitcoin/bitcoin/pull/10513#issuecomment-306083391,306083391,
ABISprotocol,2017-06-06T01:42:08Z,"Although this is marked Trivial, I request that you reopen this [because of the following reasons](https://www.quora.com/Should-the-quotation-mark-be-placed-before-or-after-a-period-comma).\n\nAlternatively, please retract statements you have made that ""grammar is bad"" - @paveljanik - and that ""neither change seems to be fixing any grammar"" - @fanquake - and then propose a new issue dealing with",https://github.com/bitcoin/bitcoin/pull/10513#issuecomment-306357523,306357523,
paveljanik,2017-06-06T05:33:14Z,"I can't retract my opinion. I'm non English native speaker, do not care about en_US and en_UK differences and do not care about your side in that ""fight"".",https://github.com/bitcoin/bitcoin/pull/10513#issuecomment-306386430,306386430,
ABISprotocol,2017-06-06T06:10:34Z,"@paveljanik It's an interesting position, not to care about someone else's thoughts or views.  It's not a fight, but it is a legitimate question.  As said, trivial, but look at it like this.  What logic is there in imposing UK grammar on everybody who is using English?  \n\nIt strikes me that (again, as pointed out) that although this is trivial, it is worth a bit of discussion.",https://github.com/bitcoin/bitcoin/pull/10513#issuecomment-306391621,306391621,
laanwj,2017-06-06T08:56:00Z,"Please don't tag me in this, I have no duck in this fight. Life is too short to have long arguments about minor language issues IMO. I try to focus on changes affecting performance, user experience, stability and testing.",https://github.com/bitcoin/bitcoin/pull/10513#issuecomment-306424369,306424369,
ABISprotocol,2017-06-06T15:48:17Z,"Not intended to be a fight, as mentioned, but if you are focusing on changes affecting user experience, this would be one of them.",https://github.com/bitcoin/bitcoin/pull/10513#issuecomment-306529545,306529545,
