Linrono,2018-05-04T17:42:40Z,I went ahead and made the change suggested by @laanwj. I also threw in a period on another line for conformity's sake.,https://github.com/bitcoin/bitcoin/pull/13118#issuecomment-386675195,386675195,
laanwj,2018-05-14T11:48:17Z,"Looks good to me.\nPlease squash your commits (see here how: https://github.com/bitcoin/bitcoin/blob/master/CONTRIBUTING.md#squashing-commits), then this should be ready for merge.",https://github.com/bitcoin/bitcoin/pull/13118#issuecomment-388789430,388789430,
Linrono,2018-05-17T03:42:00Z,Squashing done.,https://github.com/bitcoin/bitcoin/pull/13118#issuecomment-389735159,389735159,
laanwj,2018-07-10T14:19:57Z,utACK dae0d13bbb710346a8f4c8ecdf96937283e470df,https://github.com/bitcoin/bitcoin/pull/13118#issuecomment-403839721,403839721,
laanwj,2018-05-02T10:49:13Z,"I don't think this log message 'user has been found' is very illuminating, out of the blue. Something like `Using rpcauth authentication` would be clearer, I think.",https://github.com/bitcoin/bitcoin/pull/13118#discussion_r185457889,185457889,src/httprpc.cpp
Linrono,2018-05-02T13:12:14Z,"I 100% agree with you and had that originally. The reason I changed it is because I do no verification that the entries are valid, just that they exist. I wanted to put the log wherever the client did the verification of them; but, as far as I can tell, they aren't even looked at until an RPC user authentication is attempted. I didn't want to promise that they are being used without doing so, and ",https://github.com/bitcoin/bitcoin/pull/13118#discussion_r185490074,185490074,src/httprpc.cpp
