gavinandresen,2013-01-30T21:11:49Z,ACK.\n\nTested; fixes #2228 and #2239 \n,https://github.com/bitcoin/bitcoin/pull/2249#issuecomment-12912739,12912739,
sipa,2013-01-30T21:13:10Z,No way this fixes #2228 ...\n,https://github.com/bitcoin/bitcoin/pull/2249#issuecomment-12912815,12912815,
gavinandresen,2013-01-30T21:16:34Z,@sipa : I stand corrected: it fixes a variant of #2228 where no IBD was done if you start with an empty data directory and -reindex.\n,https://github.com/bitcoin/bitcoin/pull/2249#issuecomment-12912967,12912967,
sipa,2013-01-30T21:17:59Z,"Ok, that seems plausible.\n",https://github.com/bitcoin/bitcoin/pull/2249#issuecomment-12913017,12913017,
gavinandresen,2013-02-01T21:07:34Z,"I take back my ACK:  this breaks unit tests. TestingSetup() in test/test_bitcoin.cpp needs to call InitBlockIndex, I think.\n",https://github.com/bitcoin/bitcoin/pull/2249#issuecomment-13014195,13014195,
sipa,2013-02-01T22:33:05Z,Fixed.\n,https://github.com/bitcoin/bitcoin/pull/2249#issuecomment-13017771,13017771,
BitcoinPullTester,2013-02-05T15:05:54Z,"Automatic sanity-testing: PASSED, see http://jenkins.bluematt.me/pull-tester/386037615ae02f972287a958d22a5bd2760626a7 for binaries and test log.\n",https://github.com/bitcoin/bitcoin/pull/2249#issuecomment-13133174,13133174,
