dgenr8,2014-04-10T19:13:40Z,"Should CWallet::ReacceptWalletTransactions() add unconfirmed watch-only transactions to the mempool?\n\n#3883 (dyslexia alert, not 3383) adds an IsMine check to prevent this for tracked doublespends.  It looks that should be IsMine==MINE_SPENDABLE if watches are not to be broadcast.\n",https://github.com/bitcoin/bitcoin/pull/4045#issuecomment-40126156,40126156,
ghost,2014-07-07T14:14:21Z,@tuttleorbuttle Thank you for your diligence with this PR and thanks for everyone who participated and tested. I think this is an awesome feature and will be really appreciated by users.\n,https://github.com/bitcoin/bitcoin/pull/4045#issuecomment-48183256,48183256,
ocZio,2014-07-07T17:07:54Z,Can't wait!\n,https://github.com/bitcoin/bitcoin/pull/4045#issuecomment-48207189,48207189,
xor-freenet,2014-07-07T17:59:21Z,"Thanks for this.\nThere are two features which I think must also be implemented to make this useful:\n1. Dump all public keys (= your own Bitcoin addresses), in a wallet, including ones without coins, to JSON.\n2. Batch-import such a JSON as watchonly addresses.\n\nReasons:\n- This is useful if you have several cold storage wallets whose addresses you want to watch with an online wallet.\n- As add",https://github.com/bitcoin/bitcoin/pull/4045#issuecomment-48214691,48214691,
laanwj,2014-07-08T07:36:39Z,"1) This is already possible, with `dumpwallet`. It doesn't output to JSON, but the wallet interchange format contains the address and is easy to parse and convert. It does contain the private key too, though. Maybe a function that gives only public keys would be useful.\n2) This is already possible with JSON-RPC batch processing, you can submit an array of importaddress requests with rescan=false\",https://github.com/bitcoin/bitcoin/pull/4045#issuecomment-48280945,48280945,
xor-freenet,2014-07-08T08:07:36Z,"@laanwj\n\n> 1) This is already possible, with dumpwallet. It doesn't output to JSON, but the wallet interchange format contains the address and is easy to parse and convert. It does contain the private key too, though. Maybe a function that gives only public keys would be useful.\n\nFor the paranoid it is a must have to be absolutely sure that the data does not contain any private keys. Therefore",https://github.com/bitcoin/bitcoin/pull/4045#issuecomment-48283236,48283236,
laanwj,2014-07-08T10:06:13Z,"There _is_ an importwallet command, actually. And WIF is not a non-standard format, the idea is that different wallets use the same format. The format could be extended with address-only entries (or maybe that already exists) which should then also be imported/exported.\n\nAdding a parameter to dumpwallet to just export addresses could make sense, although if it is just a boolean it makes it less ",https://github.com/bitcoin/bitcoin/pull/4045#issuecomment-48303087,48303087,
tuttleorbuttle,2014-07-09T13:32:13Z,"thank you for merging it and thanks to sipa and laanwj for doing the complicated work.\n\nI just noticed that 'getbalance' seems to be somewhat broken now, if I try to exclude watchonly transactions I get a higher balance than I should have. I'll have a look at d4640d7 later today or tomorrow and create a PR as soon as I have a solution.\n",https://github.com/bitcoin/bitcoin/pull/4045#issuecomment-48469577,48469577,
tuttleorbuttle,2014-07-14T10:37:15Z,"Solution is in #4525. That was a ridiculously small mistake.\nSorry for not pushing the fix sooner, was having trouble with my local testnet.\n",https://github.com/bitcoin/bitcoin/pull/4045#issuecomment-48885765,48885765,
jessepeterson,2014-08-08T17:16:05Z,"I've got some questions on scalability of watch-only addresses.\n\nI'm a little hazy on the difference between accounts and address groupings and how they relate to watch-only addresses. But I noticed [here](https://en.bitcoin.it/wiki/Accounts_explained) that it says:\n\n> The accounts code does not scale up to thousands of accounts with tens of thousands of transactions, because by-account (and b",https://github.com/bitcoin/bitcoin/pull/4045#issuecomment-51631165,51631165,
jgarzik,2014-08-08T17:35:47Z,"The limiting factor is really the wallet scalability, and that has little to do with watch-only addresses.\n\n10,000 addresses is a tiny amount, but you run into memory use and other issues once you are managing million+ keys.\n",https://github.com/bitcoin/bitcoin/pull/4045#issuecomment-51633428,51633428,
laanwj,2014-08-09T06:06:46Z,"@jessepeterson Watch-only would be something that is trivial to scale. Just run multiple servers w/bitcoind, set a maximum of addresses per server (depending on the memory available on the server - you'd have to profile what is a sane value), and once a server is full, add a next server.\n\nDon't confuse scalablity with efficiency. Scalability just means that it's possible to add more hardware to ",https://github.com/bitcoin/bitcoin/pull/4045#issuecomment-51678415,51678415,
laanwj,2014-04-29T11:21:56Z,"There is no use in passing a dynamically-generated string to tr. Qt's translation tools scan the source code looking for tr(""...string...""). If you want a dynamic label, put the tr(...) above, so \n\n```\nQString addressOwned = wallet->IsMine(txout) == MINE_SPENDABLE ? tr(""own address"") : tr(""watch-only"");\n...\nstrHTML += ... + addressOwned + ...\n```\n",https://github.com/bitcoin/bitcoin/pull/4045#discussion_r12088317,12088317,src/qt/transactiondesc.cpp
laanwj,2014-04-29T11:26:21Z,"Nit: for readability I'd prefer this to be linear, instead of a nested 'pyramid', ie\n\n```\nif (params.size() > 0)\n{\n    strAccount = params[0].get_str();\n}\nif (params.size() > 1)\n{\n    nCount = params[1].get_int();\n}\n...\n```\n\nAfter all, params.size()>2 implies params.size()>1 ... and so on.\n",https://github.com/bitcoin/bitcoin/pull/4045#discussion_r12088437,12088437,src/rpcwallet.cpp
laanwj,2014-04-29T11:33:08Z,"Do you need to create this include-dependency on keystore.h?\n(if you need this for CTxDestination, I'd suggest doing a forward declaration)\n\nEdit: Hm that may not work as CTxDestination is defined using a template.\n",https://github.com/bitcoin/bitcoin/pull/4045#discussion_r12088639,12088639,src/walletdb.h
laanwj,2014-04-29T11:50:57Z,"You could move the \n\n```\nfIsMine = (pwallet->IsMine(txout) & filter);\n```\n\nto before and outside the if statement (for example to the instantiation of the variable on line 767). This avoids repeating it twice here, and removes the need for the hard-to-read 'assignment in if() clause' below.\n",https://github.com/bitcoin/bitcoin/pull/4045#discussion_r12089063,12089063,src/wallet.cpp
laanwj,2014-04-29T11:56:24Z,In many other places (at least in the rpcwallet) you default the filter to only MINE_SPENDABLE. Do you have a specific reason for doing (MINE_SPENDABLE|MINE_WATCH_ONLY) here? [may be a potential source of bugs]\n,https://github.com/bitcoin/bitcoin/pull/4045#discussion_r12089200,12089200,src/wallet.h
tuttleorbuttle,2014-04-29T15:18:17Z,that one is not from me but I can have a look at it.\n,https://github.com/bitcoin/bitcoin/pull/4045#discussion_r12098461,12098461,src/walletdb.h
tuttleorbuttle,2014-04-29T15:18:28Z,"okay, will change the string thing.\n\nabout the GUI: yeah i know it's not perfect. if that's a dealbreaker I'll change it sometime but I'll be glad if someone else fixes it instead.\nand yes, it's like bitcoin-qt was made to have an extra column there :D\n",https://github.com/bitcoin/bitcoin/pull/4045#discussion_r12098473,12098473,src/qt/transactiondesc.cpp
tuttleorbuttle,2014-04-29T15:19:07Z,"hm you are right, it looks better in linear form.\n",https://github.com/bitcoin/bitcoin/pull/4045#discussion_r12098509,12098509,src/rpcwallet.cpp
tuttleorbuttle,2014-04-29T15:39:12Z,iirc the reason for this is that i started with the GUI related code and did the rpcwallet code at the very end.\n\nIn most places I found it useful to include watchonly addresses in Debit/Credit calculations.\ne.g to find out if a transaction is relevant to you:\n    bool IsFromMe(const CTransaction& tx) const\n    {\n        return (GetDebit(tx) > 0);\n    }\n\nIn the rpcwallet i would actually ,https://github.com/bitcoin/bitcoin/pull/4045#discussion_r12099631,12099631,src/wallet.h
tuttleorbuttle,2014-04-29T15:41:27Z,"heh, silly me. you are right of course. it's a leftover from some experiment.\n",https://github.com/bitcoin/bitcoin/pull/4045#discussion_r12099748,12099748,src/wallet.cpp
laanwj,2014-04-29T15:53:25Z,Thanks for the explanation. Another option would be not to include a default argument at all. Let all caller sites explicitly specify what they want.\n\nBTW: how about a MINE_ALL constant that is defined as `(MINE_SPENDABLE|MINE_WATCH_ONLY)`? Beats repeating it everywhere :)\n,https://github.com/bitcoin/bitcoin/pull/4045#discussion_r12100435,12100435,src/wallet.h
tuttleorbuttle,2014-04-29T15:55:53Z,"I changed this to ""Total credit"" because i found it irritating, it was somewhat like:\nDebit: X\nCredit: Y\nCredit: Z\nIt's not really related to watchonly addresses though so i can revert it if someone is unhappy with this.\n",https://github.com/bitcoin/bitcoin/pull/4045#discussion_r12100573,12100573,src/qt/transactiondesc.cpp
tuttleorbuttle,2014-04-29T16:02:15Z,"MINE_ALL sounds like a good idea.\nI don't care if we include a default argument or not, will do whatever you think is best :p\n",https://github.com/bitcoin/bitcoin/pull/4045#discussion_r12101015,12101015,src/wallet.h
laanwj,2014-04-29T16:07:18Z,"I prefer explicit. That's easier for reviewing, as we can check each caller site and see if the right argument was passed. And it makes it harder to introduce bugs by thinking that the default is something else than what it is.\n",https://github.com/bitcoin/bitcoin/pull/4045#discussion_r12101352,12101352,src/wallet.h
,2014-04-29T16:16:54Z,"I'm not sure I like the use of ""mine"" here in the API and constants. `IsOwner`, `ADDRESS_SPENDABLE`, `ADDRESS_WATCH_ONLY` (or `KEY_*`) and so on.\n",https://github.com/bitcoin/bitcoin/pull/4045#discussion_r12101964,12101964,src/wallet.h
tuttleorbuttle,2014-04-29T17:21:58Z,forward declaring it as class CTxDestination didn't work. there are probably other ways but I'm not so well versed in template techniques.\n,https://github.com/bitcoin/bitcoin/pull/4045#discussion_r12105296,12105296,src/walletdb.h
laanwj,2014-04-29T18:15:19Z,"OK just leave it be, then.\n",https://github.com/bitcoin/bitcoin/pull/4045#discussion_r12108361,12108361,src/walletdb.h
tuttleorbuttle,2014-05-16T12:04:57Z,"okay, so i will\n- add MINE_ALL\n- remove default values from getdebit, getcredit,..\n- rename MINE_ to ADDRESS_\n",https://github.com/bitcoin/bitcoin/pull/4045#discussion_r12734894,12734894,src/wallet.h
