laanwj,2016-10-01T15:04:59Z,"Concept ACK, though IMO using named arguments is even more readable for ancillary arguments like timeout.\n",https://github.com/bitcoin/bitcoin/pull/8857#issuecomment-250917056,250917056,
MarcoFalke,2016-10-01T15:19:12Z,"Agree, but note that the arguments _are_ variables with the name `timeout`, but are _not_ named arguments in `maxuploadtarget.py` and `p2p-mempool.py`. I don't think we can catch such issues during review in the future, we should probably force to name them...\n",https://github.com/bitcoin/bitcoin/pull/8857#issuecomment-250917738,250917738,
laanwj,2016-10-01T15:25:15Z,Nice solution. utACK https://github.com/bitcoin/bitcoin/pull/8857/commits/faf9c3a359959a07a1ee1d55102363fb58b43116\n,https://github.com/bitcoin/bitcoin/pull/8857#issuecomment-250918031,250918031,
btcdrak,2016-10-01T19:04:32Z,utACK faf9c3a\n,https://github.com/bitcoin/bitcoin/pull/8857#issuecomment-250930732,250930732,
MarcoFalke,2016-10-02T10:22:12Z,Squashed both commits into fa66609\n,https://github.com/bitcoin/bitcoin/pull/8857#issuecomment-250964259,250964259,
btcdrak,2016-10-02T17:13:10Z,re-utACK fa66609\n,https://github.com/bitcoin/bitcoin/pull/8857#issuecomment-250982498,250982498,
