fanquake,2014-12-03T13:50:34Z,"Testing with boost 1.56.0 and ./configure CXXFLAGS=""-DDEBUG_LOCKORDER -g -std=c++11""\n\nThe changes fix the issue described in #5166, but introduce a new compile error.\n\n```\nIn file included from ./allocators.h:9:\nIn file included from /Applications/Xcode.app/Contents/Developer/Toolchains/XcodeDefault.xctoolchain/usr/bin/../include/c++/v1/map:423:\nIn file included from /Applications/Xcode.app",https://github.com/bitcoin/bitcoin/pull/5415#issuecomment-65408890,65408890,
laanwj,2014-12-03T13:58:23Z,"Ok, closing then, it's not a fix if it causes a new problem.\n",https://github.com/bitcoin/bitcoin/pull/5415#issuecomment-65409997,65409997,
theuni,2014-12-08T20:06:33Z,"Fwiw, that doesn't look like a ""new"" problem. It appears to just get past the first issue and further into the build before it runs into a different c++11 incompatibility.\n",https://github.com/bitcoin/bitcoin/pull/5415#issuecomment-66177830,66177830,
laanwj,2014-12-09T08:06:27Z,I submitted this under the pretense that this was the only c++11 incompatibility. Seemingly it's one of many so it's not worth doing this now.\n,https://github.com/bitcoin/bitcoin/pull/5415#issuecomment-66247227,66247227,
theuni,2014-12-18T04:28:35Z,"Just posting for posterity: This was indeed the only incompatibility I ran into in Linux.\n\nThe error above is libstdc++-specific, but it's a legitimate bug in c++11 mode. See: http://llvm.org/bugs/show_bug.cgi?id=13471\n\nI have it hack-fixed locally, but it involves a good bit of code movement.\n",https://github.com/bitcoin/bitcoin/pull/5415#issuecomment-67440015,67440015,
theuni,2014-12-18T05:16:11Z,err.. s/libstdc++/libc++/\n,https://github.com/bitcoin/bitcoin/pull/5415#issuecomment-67442395,67442395,
