jonatack,2021-01-18 21:58:25,Wow! Concept ACK.,https://github.com/bitcoin/bitcoin/pull/20960#issuecomment-762487914,762487914,
practicalswift,2021-01-18 21:59:48,Concept ACK,https://github.com/bitcoin/bitcoin/pull/20960#issuecomment-762488440,762488440,
laanwj,2021-01-19 11:25:06,"> The two needed commits adding the documented tracepoints would be 16ed9bc and ea608d9 from this branch laanwj:usdt-probes. Did you mean to merge them first?\n\nNo, that's not my work, it's @jb55's. I'm really confused here.",https://github.com/bitcoin/bitcoin/pull/20960#issuecomment-762780891,762780891,
jb55,2021-01-19 15:29:03,"""Wladimir J. van der Laan"" <notifications@github.com> writes:\n\n>> The two needed commits adding the documented tracepoints would be\n>> 16ed9bc and ea608d9 from this branch laanwj:usdt-probes. Did you mean\n>> to merge them first?\n>\n> No, that's not my work, it's @jb55's. I'm really confused here.\n\nWe only merged the build support for static traces. You mentioned that\nwe should get that in ",https://github.com/bitcoin/bitcoin/pull/20960#issuecomment-762917345,762917345,
jnewbery,2021-01-21 11:02:28,"I think we should probably get a concept ACK from other contributors on whether we should start adding tracepoints all over the code. I can see the benefit that they're very powerful and add almost no overhead when not used. On the other hand, there's almost an unlimited number of things that could be traced, adding `TRACE()` macros in lots of places could potentially make the source less readable",https://github.com/bitcoin/bitcoin/pull/20960#issuecomment-764556492,764556492,
jb55,2021-01-21 19:49:47,"John Newbery <notifications@github.com> writes:\n> adding `TRACE()` macros in lots of places could potentially make the\n> source less readable, and it's possible to do a lot of useful tracing\n> with uprobes that don't require any changes to the source.\n\nagreed, USDTs should accompanied by motivating examples and scripts. No\npoint adding USDTs that noone uses.\n",https://github.com/bitcoin/bitcoin/pull/20960#issuecomment-764895360,764895360,
0xB10C,2021-05-20 17:16:55,picked this up in https://github.com/bitcoin/bitcoin/pull/22006,https://github.com/bitcoin/bitcoin/pull/20960#issuecomment-845307701,845307701,
