laanwj,2016-02-01T09:33:32Z,The reordering makes it harder to see what actually changed in the text :(\n,https://github.com/bitcoin/bitcoin/pull/7444#issuecomment-177874653,177874653,
MarcoFalke,2016-02-01T12:02:15Z,Maybe just do it without the reordering?\n,https://github.com/bitcoin/bitcoin/pull/7444#issuecomment-177939314,177939314,
petertodd,2016-02-02T04:22:45Z,"What can I say, it is just two actual non-comment lines changed. :)\n",https://github.com/bitcoin/bitcoin/pull/7444#issuecomment-178363991,178363991,
laanwj,2016-02-02T14:32:05Z,"Yes, which would have been easier to see if the move and text change were separate commits.\n\nAnyhow, these are the text changes:\n\n``` patch\n--- a/src/main.h\n+++ b/src/main.h\n@@ -413,14 +413,18 @@ bool ReadBlockFromDisk(CBlock& block, const CBlockIndex* pindex, const Consensus\n  *  of problems. Note that in any case, coins may be modified. */\n bool DisconnectBlock(const CBlock& block, CVal",https://github.com/bitcoin/bitcoin/pull/7444#issuecomment-178599272,178599272,
paveljanik,2016-02-02T16:19:20Z,ACK https://github.com/petertodd/bitcoin/commit/2f19905324078e07d8c21b991ef010da80403d95\n,https://github.com/bitcoin/bitcoin/pull/7444#issuecomment-178665880,178665880,
sipa,2016-02-02T16:45:56Z,ACK\n,https://github.com/bitcoin/bitcoin/pull/7444#issuecomment-178681885,178681885,
petertodd,2016-02-02T18:02:38Z,@laanwj Fair enough; I'll split changes like that into two commits in the future.\n,https://github.com/bitcoin/bitcoin/pull/7444#issuecomment-178724183,178724183,
