ghost,2014-10-28T01:59:13Z,"> You can sign messages/contracts with your addresses to prove you receive bitcoins sent to them. \n\nI think it might read a bit better as something like \n\n> You can sign messages/contracts with your addresses to prove you own Bitcoin received by them. \n\nNot quite sure that goes far enough though, it's a difficult concept to convert in a few sentences. \n",https://github.com/bitcoin/bitcoin/pull/5144#issuecomment-60699439,60699439,
sipa,2014-10-28T03:22:45Z,"""Contracts"" may be confusing without further elaboration. Also, maybe say ""you **can** receive bitcoins sent to them"" ?\n",https://github.com/bitcoin/bitcoin/pull/5144#issuecomment-60704952,60704952,
luke-jr,2014-10-30T01:37:40Z,"@BitcoinPullTesterHuman It doesn't prove you own bitcoins received by them - you may have spent the bitcoins since receiving them. And no, spending them doesn't imply the output is ""spent"" on the blockchain. This kind of confusion is exactly what I'm trying to address here. ;)\n\n@sipa Maybe ""messages/agreements"" then? Changes made.\n",https://github.com/bitcoin/bitcoin/pull/5144#issuecomment-61033569,61033569,
ghost,2014-10-30T02:06:58Z,"@luke-jr It's extremely hard to word that sort of thing properly, a lot of the terms used when referring to addresses and transactions are ambiguous, or have different meanings to developers and users. I read the phrase ""bitcoins sent to them"" as making it sound like there's a ""bitcoin"" which can move from address to address. I don't think it helps much, but I was attempting to use ""bitcoin"" as po",https://github.com/bitcoin/bitcoin/pull/5144#issuecomment-61035680,61035680,
sipa,2014-12-05T14:50:20Z,Looks good to me.\n,https://github.com/bitcoin/bitcoin/pull/5144#issuecomment-65799299,65799299,
jonasschnelli,2015-01-09T15:07:15Z,ACK\n,https://github.com/bitcoin/bitcoin/pull/5144#issuecomment-69345732,69345732,
