jgarzik,2014-01-17T12:43:51Z,"We can merge anytime.  It will only impact a few, until release.\n",https://github.com/bitcoin/bitcoin/pull/3551#issuecomment-32602668,32602668,
gavinandresen,2014-01-17T14:54:11Z,"Did you check to make sure there are no blocks before block 279,000 with a timestamp after the timestamp of the checkpoint, and there is no block after with a timestamp before?\n",https://github.com/bitcoin/bitcoin/pull/3551#issuecomment-32611874,32611874,
bardiharborow,2014-01-18T08:32:51Z,"@Michagogo, @gavinandresen, just recently I was thinking about this but the timestamp requirements scared me off. Why don't we make a program that automatically checks the timestamp requirements? \n",https://github.com/bitcoin/bitcoin/pull/3551#issuecomment-32677330,32677330,
laanwj,2014-01-18T11:01:21Z,"@bardiharborow Yes such as script would be useful, please do\n",https://github.com/bitcoin/bitcoin/pull/3551#issuecomment-32679414,32679414,
sipa,2014-01-18T17:10:59Z,"ACK. Numbers are correct, and timestamps around block 279000 are strictly increasing.\n",https://github.com/bitcoin/bitcoin/pull/3551#issuecomment-32686870,32686870,
Michagogo,2014-01-18T19:27:10Z,"@gavinandresen I see that @sipa already mentioned it, but yes, I did check that before putting this block in the PR. (that's what I was referring to in the commit message for ~~ffb5e48~~ e7906d1)\n",https://github.com/bitcoin/bitcoin/pull/3551#issuecomment-32690514,32690514,
Michagogo,2014-01-18T19:55:42Z,Rebased.\n,https://github.com/bitcoin/bitcoin/pull/3551#issuecomment-32691299,32691299,
BitcoinPullTester,2014-01-18T20:16:36Z,"Automatic sanity-testing: PASSED, see http://jenkins.bluematt.me/pull-tester/6873cfb6c0efaeb645ef0a7074651623bb4bec82 for binaries and test log.\nThis test script verifies pulls every time they are updated. It, however, dies sometimes and fails to test properly.  If you are waiting on a test, please check timestamps to verify that the test.log is moving at http://jenkins.bluematt.me/pull-tester/cu",https://github.com/bitcoin/bitcoin/pull/3551#issuecomment-32691862,32691862,
bardiharborow,2014-01-18T22:53:10Z,"Ok, block 279,000 is confirmed by 2206 blocks as of the time of writing. Are we ready to merge?\n",https://github.com/bitcoin/bitcoin/pull/3551#issuecomment-32695702,32695702,
