BitcoinPullTester,2013-12-15T14:37:34Z,"Automatic sanity-testing: PASSED, see http://jenkins.bluematt.me/pull-tester/3e321180e2d559da67f23afae62beeee401d5ef2 for binaries and test log.\nThis test script verifies pulls every time they are updated. It, however, dies sometimes and fails to test properly.  If you are waiting on a test, please check timestamps to verify that the test.log is moving at http://jenkins.bluematt.me/pull-tester/cu",https://github.com/bitcoin/bitcoin/pull/3413#issuecomment-30608045,30608045,
sipa,2013-12-15T12:56:35Z,That's strange style...?\n,https://github.com/bitcoin/bitcoin/pull/3413#discussion_r8354882,8354882,src/qt/addresstablemodel.cpp
laanwj,2013-12-15T12:58:28Z,"So, how would you propose doing it? I didn't want to double-indent the entire block either.\n",https://github.com/bitcoin/bitcoin/pull/3413#discussion_r8354883,8354883,src/qt/addresstablemodel.cpp
laanwj,2013-12-15T14:10:52Z,@sipa I've refactored the function a bit do prevent the strange style anywhere and make it easier to read\n,https://github.com/bitcoin/bitcoin/pull/3413#discussion_r8355030,8355030,src/qt/addresstablemodel.cpp
Diapolo,2013-12-23T14:17:54Z,"I find such else if's rather hard to read, when they are behind a `}`.\n",https://github.com/bitcoin/bitcoin/pull/3413#discussion_r8527139,8527139,src/qt/addresstablemodel.cpp
laanwj,2013-12-23T14:20:47Z,"Let's just agree that this is better than the original?\nThe point of this pull is to fix some serious locking issues, not to change the code into a work of art.\n",https://github.com/bitcoin/bitcoin/pull/3413#discussion_r8527174,8527174,src/qt/addresstablemodel.cpp
Diapolo,2013-12-23T14:26:19Z,"Sure and agreed, but I'm allowed to give such feedback anyway :)?\nI consider myself of no help in code parts with locking and such, sorry...\n",https://github.com/bitcoin/bitcoin/pull/3413#discussion_r8527255,8527255,src/qt/addresstablemodel.cpp
