Diapolo,2012-04-13T16:29:35Z,"Dunno why, but the default is now even readable on Win7 as the text stays black, no matter if the Window is active or not ... I'm fine with the OS default then!\n",https://github.com/bitcoin/bitcoin/pull/1091#issuecomment-5118349,5118349,
jgarzik,2012-04-15T15:34:58Z,"The dominant bitcoin coding style is overwhelmingly ""if ("", with a space.  Two seconds of grep would show that...\n\nLet us continue to be consistent with the rest of the code.\n",https://github.com/bitcoin/bitcoin/pull/1091#issuecomment-5139975,5139975,
laanwj,2012-04-15T15:43:57Z,"Maybe in the core. Not in the Qt code.\n\nWhatever the common coding style is, commits shouldn't be cluttered with unrelated changes.\n",https://github.com/bitcoin/bitcoin/pull/1091#issuecomment-5140032,5140032,
sipa,2012-04-17T20:43:13Z,Why was this merged? This is how it looks now for me: http://bitcoin.sipa.be/bitcoinqt.png\n,https://github.com/bitcoin/bitcoin/pull/1091#issuecomment-5185404,5185404,
laanwj,2012-04-17T20:48:21Z,Sipa: See discussion on #1071. We intend to only override the style in specific cases. In most cases the OS default simply works.\n,https://github.com/bitcoin/bitcoin/pull/1091#issuecomment-5185551,5185551,
laanwj,2012-04-13T19:00:52Z,"Why add spaces here? Most if the ifs() are like this, and IMO that's fine.\n",https://github.com/bitcoin/bitcoin/pull/1091#discussion_r683383,683383,src/qt/bitcoingui.cpp
Diapolo,2012-04-13T19:57:20Z,"There are at least 5 places in where it is if () instead of if(). What \ndo you prefer? I'll use that in the future, if we don't get a new \nstandard coding style, so that you and I use the same as we often work \non the same code parts.\n",https://github.com/bitcoin/bitcoin/pull/1091#discussion_r683691,683691,src/qt/bitcoingui.cpp
laanwj,2012-04-14T06:00:42Z,"I always use this coding style for if/expressions:\n\n```\nif(a && !b && ((c + d) < e)) \n{\n} \nelse [if(...)]\n{\n}\n```\n\nYou can recognize other people's code if it is different :-) So I prefer it that way, but won't reject pull requests on it unless it's an absolute mess otherwise. \n\nMy point was that here's no need to change this function in this patch. We like minimal changes for small t",https://github.com/bitcoin/bitcoin/pull/1091#discussion_r684968,684968,src/qt/bitcoingui.cpp
