laanwj,2015-01-14T12:02:49Z,Seems to be correct change.\nACK\n,https://github.com/bitcoin/bitcoin/pull/5658#issuecomment-69906819,69906819,
luke-jr,2015-01-14T14:27:09Z,"@dvitas A standard transaction is any transaction specified for use by multiple people/software. Note that in general, you should use existing standards (generally BIPs) when you have a need for their intended purpose, and if you have a new use case, write a new standard describing an appropriate way to accomplish that. Trying to design something to target IsStandardTx, which changes based on spec",https://github.com/bitcoin/bitcoin/pull/5658#issuecomment-69922950,69922950,
laanwj,2015-01-20T14:14:36Z,@cfields trivial ping\n,https://github.com/bitcoin/bitcoin/pull/5658#issuecomment-70658877,70658877,
laanwj,2015-01-29T11:57:19Z,@cfields can you merge this into your trivial branch?\n,https://github.com/bitcoin/bitcoin/pull/5658#issuecomment-72012880,72012880,
theuni,2015-01-30T05:06:55Z,"Merged. These have stacked up somewhat now, ready for a rebased PR to master?\n",https://github.com/bitcoin/bitcoin/pull/5658#issuecomment-72154854,72154854,
laanwj,2015-01-30T10:46:49Z,"Yes, I think we should try that to see how it goes.\n",https://github.com/bitcoin/bitcoin/pull/5658#issuecomment-72183746,72183746,
