laanwj,2020-12-09 20:45:06,Do we have any idea why this is needed? Why does this particular function raise a false positive?,https://github.com/bitcoin/bitcoin/pull/20558#issuecomment-742038456,742038456,
MarcoFalke,2020-12-10 06:36:28,"I have no clue. If someone knows why or even how to track this down (which is difficult because it happens intermittently), please let me know.",https://github.com/bitcoin/bitcoin/pull/20558#issuecomment-742275655,742275655,
MarcoFalke,2020-12-10 06:37:34,"Though, having ci fail on known issues whose fix is unknown only increases frustration having to reset the builds.",https://github.com/bitcoin/bitcoin/pull/20558#issuecomment-742276121,742276121,
laanwj,2020-12-16 16:07:54,"Yeah. What I'm a little bit worried about is that it might be an actual problem and not a false positive, in which case it would be a really bad idea to silence it.\nBut I don't know how to debug this either.",https://github.com/bitcoin/bitcoin/pull/20558#issuecomment-746547333,746547333,
DrahtBot,2021-04-14 09:08:41,"<!--cf906140f33d8803c4a75a2196329ecb-->\n🐙 This pull request conflicts with the target branch and [needs rebase](https://github.com/bitcoin/bitcoin/blob/master/CONTRIBUTING.md#rebasing-changes).\n\n<sub>Want to unsubscribe from rebase notifications on this pull request? Just convert this pull request to a ""draft"".</sub>",https://github.com/bitcoin/bitcoin/pull/20558#issuecomment-819363400,819363400,
